
(lymph_env) D:\Ibrahim\BassamGaF\Analysis\Scripts\Python>python mpox_mooB_optimized_v7_1.py --data_root "D:\Ibrahim\BassamGaF\Analysis\Data\Unified_Selected\Augmented Images" --pos_class "Monkeypox_augmented" --neg_class "Others_augmented" --pos_list_file "D:\Ibrahim\BassamGaF\Analysis\Data\Unified_Selected\lists\Unified_Monkey_Aug.txt" --neg_list_file "D:\Ibrahim\BassamGaF\Analysis\Data\Unified_Selected\lists\Unified_NonMonkey_Aug.txt" --orig_root "D:\Ibrahim\BassamGaF\Analysis\Data\Unified_Selected\Original Images" --orig_pos_class "Monkey Pox" --orig_neg_class "Others" --orig_pos_list_file "D:\Ibrahim\BassamGaF\Analysis\Data\Unified_Selected\lists\Unified_Monkey_Original.txt" --orig_neg_list_file "D:\Ibrahim\BassamGaF\Analysis\Data\Unified_Selected\lists\Unified_NonMonkey_Original.txt" --eval_on_original_only --split_strategy group_stratified --group_mode regex --group_regex "^(?:v[0-9]+__)?(.+?)(?:_(?:ORIGINAL|[0-9]+))?$" --cv_folds 5 --cv_val_frac 0.20 --models "efficientnetv2_s,convnext_tiny,vit_b_16,resnet50,densenet121,efficientnet_b0,mobilenet_v3_large" --img_size 224 --pretrained --amp --tta 16 --use_weighted_sampler --train_mix original+aug --train_orig_ratio 0.7 --max_aug_per_group 3 --finetune_on_original --finetune_epochs 5 --finetune_lr 1e-5 --freeze_backbone_epochs 0 --moo_enable --moo_objectives "auc,f1_at_precision,logloss" --moo_directions "maximize,maximize,minimize" --moo_selection_strategy f1_at_precision_first --moo_precision_target 0.80 --moo_constraint_auc_target 0.80 --moo_constraint_f1_target 0.80 --moo_eval_epochs 6 --moo_population_size 8 --moo_generations 3 --moo_top_k 3 --calibrate temperature --weighted_ensemble --ensemble_weight_metric f1_at_precision --ensemble_weight_opt random_search --ensemble_weight_trials 4096 --ensemble_weight_seed 42 --early_stop_patience 4 --early_stop_metric f1_at_precision --threshold_strategy f1_at_precision --precision_target 0.80 --moo_plot --rag_enable --rag_model auto --rag_index_source train_orig_only --rag_k 25 --rag_alpha 0.25 --rag_metric cosine --rag_weighted --rag_temp 0.07 --rag_chunk 512 --rag_tta 0 --plot_dpi 600
Device: cuda
GPU: NVIDIA GeForce RTX 4060 Laptop GPU
Dataset pools: primary=1357 samples, original=876 samples | splitting_base=original (876)
Group mode: regex  |  groups=617  avg_imgs_per_group=1.42  max_imgs_per_group=14
[NamePattern] Detected many filenames ending with _<num>: 100.0% of samples.
[NamePattern] Suggested safer group_regex: --group_regex "(.+?)_[0-9]+$"
[NamePattern] Detected filenames like base_<token>_<num>: 16.2% of samples.
[NamePattern] If your augmentation is encoded in filenames, consider --group_mode stem (or a regex that strips aug tokens).

[LeakageSanity] Example groupings (original vs augmented):
  Group 'M01' -> originals=2 (e.g. ['v1__M01_02.jpg', 'v1__M01_04.jpg']) | augmented=0 (e.g. [])
  Group 'M02' -> originals=1 (e.g. ['v1__M02_02.jpg']) | augmented=0 (e.g. [])
  Group 'M04' -> originals=1 (e.g. ['v1__M04_01.jpg']) | augmented=0 (e.g. [])
  Group 'M05' -> originals=2 (e.g. ['v1__M05_01.jpg', 'v1__M05_02.jpg']) | augmented=0 (e.g. [])
  Group 'M06' -> originals=2 (e.g. ['v1__M06_01.jpg', 'v1__M06_02.jpg']) | augmented=0 (e.g. [])
  Group 'M08' -> originals=1 (e.g. ['v1__M08_01.jpg']) | augmented=0 (e.g. [])
  Group 'M09' -> originals=2 (e.g. ['v1__M09_01.jpg', 'v1__M09_04.jpg']) | augmented=0 (e.g. [])
  Group 'M10' -> originals=1 (e.g. ['v1__M10_01.jpg']) | augmented=0 (e.g. [])
[LeakageSanity] If augmented counts are not aligned to originals, adjust --group_regex.

============================================================
FOLD: 0 (rng_seed=12345)
============================================================
[LeakageCheck] ✅ No base-stem (leakage_id) appears in more than one split (filename heuristic).

  Model: efficientnetv2_s (224x224)
    [MOO] Optuna(NSGA-II) for efficientnetv2_s -> outputs_mpox_balanced\fold_0\efficientnetv2_s\moo
    [MOO] objectives=['auc', 'f1_at_precision', 'logloss'] directions=['maximize', 'maximize', 'minimize']
    [MOO] pop=8 gens=3 trials=24 eval_epochs=6
[I 2026-03-15 15:17:53,742] A new study created in memory with name: moo_efficientnetv2_s_20260315_151753
[I 2026-03-15 15:19:18,989] Trial 0 finished with values: [0.7841117216117216, 0.405797101448904, 0.8191179178659979] and parameters: {'lr': 0.002008037330173894, 'weight_decay': 1.2591462178530709e-05, 'label_smoothing': 0.027587821751564167, 'mixup_alpha': 0.08182411142121589, 'cutmix_alpha': 0.22709001163267467, 'loss': 'focal', 'focal_alpha': 0.3459531290614713, 'focal_gamma': 2.3722665938347793, 'optimizer': 'adam', 'scheduler': 'none', 'warmup_epochs': 0.5974074275387631, 'drop_path_rate': 0.131282236616454, 'grad_clip_norm': 1.0, 'head_lr': 0.0006203779517599349}.
[I 2026-03-15 15:19:46,527] Trial 1 finished with values: [0.8862179487179487, 0.7252747252742353, 0.4109823720772793] and parameters: {'lr': 0.00039038155563885353, 'weight_decay': 0.00031237281707197285, 'label_smoothing': 0.07013985108289447, 'mixup_alpha': 0.13023387101575112, 'cutmix_alpha': 0.1758578423539238, 'loss': 'focal', 'focal_alpha': 0.353062113532131, 'focal_gamma': 2.477056294619471, 'optimizer': 'adamw', 'scheduler': 'plateau', 'warmup_epochs': 0.9834946368917719, 'drop_path_rate': 0.10525103346997158, 'grad_clip_norm': 1.0, 'head_lr': 0.0006368008499365697}.
[I 2026-03-15 15:20:24,079] Trial 2 finished with values: [0.86996336996337, 0.7032967032962135, 0.4517691291085567] and parameters: {'lr': 0.0010645160333653384, 'weight_decay': 5.487002599870537e-05, 'label_smoothing': 0.12152841132048821, 'mixup_alpha': 0.03838741029782664, 'cutmix_alpha': 0.08758001749283739, 'loss': 'focal', 'focal_alpha': 0.2878119607810443, 'focal_gamma': 2.2737744505229474, 'optimizer': 'adam', 'scheduler': 'warmup_cosine', 'warmup_epochs': 1.218987315987007, 'drop_path_rate': 0.03003669893377634, 'grad_clip_norm': 1.0, 'head_lr': 0.0018067510266103182}.
[I 2026-03-15 15:21:02,712] Trial 3 finished with values: [0.8798076923076923, 0.7191011235950198, 0.4394184745762154] and parameters: {'lr': 8.929760802149442e-05, 'weight_decay': 1.250309443757088e-05, 'label_smoothing': 0.0852591229193136, 'mixup_alpha': 0.07512721400975991, 'cutmix_alpha': 0.05033661753094809, 'loss': 'focal', 'focal_alpha': 0.32206096955959296, 'focal_gamma': 2.9330749539987124, 'optimizer': 'adam', 'scheduler': 'warmup_cosine', 'warmup_epochs': 1.007858232895831, 'drop_path_rate': 0.04512752130412789, 'grad_clip_norm': 0.5, 'head_lr': 0.0018484086339045946}.
[I 2026-03-15 15:21:41,913] Trial 4 finished with values: [0.6437728937728938, 0.0, 0.6831618294854878] and parameters: {'lr': 0.002196851309214333, 'weight_decay': 7.146824531193168e-05, 'label_smoothing': 0.037873889183614, 'mixup_alpha': 0.2883448232699392, 'cutmix_alpha': 0.14697550551783092, 'loss': 'ce', 'focal_alpha': 0.2560696940238141, 'focal_gamma': 2.127129466558014, 'optimizer': 'adam', 'scheduler': 'warmup_cosine', 'warmup_epochs': 0.21464582440208835, 'drop_path_rate': 0.18214507119308054, 'grad_clip_norm': 1.0, 'head_lr': 1.2758834036187525e-05}.
[I 2026-03-15 15:22:20,301] Trial 5 finished with values: [0.8603479853479854, 0.7446808510633356, 0.4478830587093652] and parameters: {'lr': 3.0549770625486873e-05, 'weight_decay': 1.0568584062233313e-05, 'label_smoothing': 0.09404998208578935, 'mixup_alpha': 0.034489242049100845, 'cutmix_alpha': 0.05717800792488386, 'loss': 'focal', 'focal_alpha': 0.4069877432369666, 'focal_gamma': 2.118404208305278, 'optimizer': 'adam', 'scheduler': 'plateau', 'warmup_epochs': 0.04104164931342402, 'drop_path_rate': 0.19193220279936318, 'grad_clip_norm': 1.0, 'head_lr': 0.00016317398002559875}.
[I 2026-03-15 15:23:01,035] Trial 6 finished with values: [0.7886904761904762, 0.358208955223533, 0.5827096789012517] and parameters: {'lr': 0.001972552157600415, 'weight_decay': 6.219801441815397e-05, 'label_smoothing': 0.010823982260539683, 'mixup_alpha': 0.22700331927962544, 'cutmix_alpha': 0.24609727348949773, 'loss': 'ce', 'focal_alpha': 0.229331992372645, 'focal_gamma': 0.7434829134144465, 'optimizer': 'adamw', 'scheduler': 'warmup_cosine', 'warmup_epochs': 1.4596228465823389, 'drop_path_rate': 0.08287020343790914, 'grad_clip_norm': 0.5, 'head_lr': 2.565773841975759e-05}.
[I 2026-03-15 15:23:39,622] Trial 7 finished with values: [0.8566849816849818, 0.7045454545449711, 0.46367728854135315] and parameters: {'lr': 5.953998939817118e-05, 'weight_decay': 0.00013314685368433056, 'label_smoothing': 0.05467354300782886, 'mixup_alpha': 0.0624154356805998, 'cutmix_alpha': 0.07092152536982073, 'loss': 'ce', 'focal_alpha': 0.3255538863943984, 'focal_gamma': 1.6349871897736725, 'optimizer': 'adam', 'scheduler': 'none', 'warmup_epochs': 0.3972472275176979, 'drop_path_rate': 0.18633654894059115, 'grad_clip_norm': 0.5, 'head_lr': 0.00027253458113737705}.
[I 2026-03-15 15:24:18,423] Trial 8 finished with values: [0.7777014652014652, 0.20338983050826545, 0.5534568605360415] and parameters: {'lr': 0.002008037330173894, 'weight_decay': 1.2591462178530709e-05, 'label_smoothing': 0.027587821751564167, 'mixup_alpha': 0.08182411142121589, 'cutmix_alpha': 0.22709001163267467, 'loss': 'focal', 'focal_alpha': 0.3459531290614713, 'focal_gamma': 2.3722665938347793, 'optimizer': 'adamw', 'scheduler': 'none', 'warmup_epochs': 0.5974074275387631, 'drop_path_rate': 0.074724092746879, 'grad_clip_norm': 1.0, 'head_lr': 0.0006203779517599349}.
[I 2026-03-15 15:24:56,086] Trial 9 finished with values: [0.8727106227106227, 0.7446808510633356, 0.4309187743814079] and parameters: {'lr': 3.0549770625486873e-05, 'weight_decay': 0.00031237281707197285, 'label_smoothing': 0.07013985108289447, 'mixup_alpha': 0.13023387101575112, 'cutmix_alpha': 0.1758578423539238, 'loss': 'focal', 'focal_alpha': 0.353062113532131, 'focal_gamma': 2.118404208305278, 'optimizer': 'adamw', 'scheduler': 'plateau', 'warmup_epochs': 0.9834946368917719, 'drop_path_rate': 0.19193220279936318, 'grad_clip_norm': 1.0, 'head_lr': 0.0006368008499365697}.
[I 2026-03-15 15:25:33,550] Trial 10 finished with values: [0.9134615384615384, 0.7843137254896961, 0.4650052130750306] and parameters: {'lr': 0.00039038155563885353, 'weight_decay': 1.250309443757088e-05, 'label_smoothing': 0.07013985108289447, 'mixup_alpha': 0.13023387101575112, 'cutmix_alpha': 0.1758578423539238, 'loss': 'focal', 'focal_alpha': 0.32206096955959296, 'focal_gamma': 2.477056294619471, 'optimizer': 'adamw', 'scheduler': 'plateau', 'warmup_epochs': 1.007858232895831, 'drop_path_rate': 0.10525103346997158, 'grad_clip_norm': 1.0, 'head_lr': 0.0006368008499365697}.
[I 2026-03-15 15:26:10,678] Trial 11 finished with values: [0.8576007326007327, 0.695652173912552, 0.498789195497626] and parameters: {'lr': 5.953998939817118e-05, 'weight_decay': 5.487002599870537e-05, 'label_smoothing': 0.12152841132048821, 'mixup_alpha': 0.03838741029782664, 'cutmix_alpha': 0.08758001749283739, 'loss': 'focal', 'focal_alpha': 0.3255538863943984, 'focal_gamma': 2.2737744505229474, 'optimizer': 'adam', 'scheduler': 'warmup_cosine', 'warmup_epochs': 0.8281836023531184, 'drop_path_rate': 0.03003669893377634, 'grad_clip_norm': 1.0, 'head_lr': 0.0018067510266103182}.
[I 2026-03-15 15:26:48,006] Trial 12 finished with values: [0.565018315018315, 0.10909090909080595, 0.7035529278984702] and parameters: {'lr': 0.002196851309214333, 'weight_decay': 1.0568584062233313e-05, 'label_smoothing': 0.09058608508710066, 'mixup_alpha': 0.2883448232699392, 'cutmix_alpha': 0.268699490942095, 'loss': 'focal', 'focal_alpha': 0.4069877432369666, 'focal_gamma': 2.127129466558014, 'optimizer': 'adam', 'scheduler': 'warmup_cosine', 'warmup_epochs': 0.21464582440208835, 'drop_path_rate': 0.18214507119308054, 'grad_clip_norm': 1.0, 'head_lr': 1.2758834036187525e-05}.
[I 2026-03-15 15:27:26,454] Trial 13 finished with values: [0.7692307692307692, 0.23333333333310222, 0.7904423355925924] and parameters: {'lr': 0.001972552157600415, 'weight_decay': 0.00031237281707197285, 'label_smoothing': 0.010823982260539683, 'mixup_alpha': 0.13023387101575112, 'cutmix_alpha': 0.24609727348949773, 'loss': 'focal', 'focal_alpha': 0.353062113532131, 'focal_gamma': 2.477056294619471, 'optimizer': 'adamw', 'scheduler': 'none', 'warmup_epochs': 0.9834946368917719, 'drop_path_rate': 0.08287020343790914, 'grad_clip_norm': 0.5, 'head_lr': 2.565773841975759e-05}.
[I 2026-03-15 15:28:01,939] Trial 14 finished with values: [0.839514652014652, 0.6741573033703007, 0.566519345798039] and parameters: {'lr': 5.953998939817118e-05, 'weight_decay': 0.00013314685368433056, 'label_smoothing': 0.05467354300782886, 'mixup_alpha': 0.0624154356805998, 'cutmix_alpha': 0.07092152536982073, 'loss': 'ce', 'focal_alpha': 0.3255538863943984, 'focal_gamma': 1.6349871897736725, 'optimizer': 'adam', 'scheduler': 'none', 'warmup_epochs': 0.3972472275176979, 'drop_path_rate': 0.18633654894059115, 'grad_clip_norm': 0.5, 'head_lr': 0.00027253458113737705}.
[I 2026-03-15 15:28:36,089] Trial 15 finished with values: [0.8402014652014652, 0.5641025641021197, 0.5896780715898109] and parameters: {'lr': 3.0549770625486873e-05, 'weight_decay': 6.219801441815397e-05, 'label_smoothing': 0.10972157340566355, 'mixup_alpha': 0.034489242049100845, 'cutmix_alpha': 0.05717800792488386, 'loss': 'focal', 'focal_alpha': 0.229331992372645, 'focal_gamma': 2.118404208305278, 'optimizer': 'adam', 'scheduler': 'plateau', 'warmup_epochs': 1.4596228465823389, 'drop_path_rate': 0.08287020343790914, 'grad_clip_norm': 0.5, 'head_lr': 2.565773841975759e-05}.
[I 2026-03-15 15:29:12,146] Trial 16 finished with values: [0.8166208791208791, 0.5999999999995449, 0.5017360100820201] and parameters: {'lr': 3.0549770625486873e-05, 'weight_decay': 0.00031237281707197285, 'label_smoothing': 0.09404998208578935, 'mixup_alpha': 0.034489242049100845, 'cutmix_alpha': 0.05717800792488386, 'loss': 'focal', 'focal_alpha': 0.4069877432369666, 'focal_gamma': 2.118404208305278, 'optimizer': 'adam', 'scheduler': 'plateau', 'warmup_epochs': 0.9834946368917719, 'drop_path_rate': 0.19193220279936318, 'grad_clip_norm': 1.0, 'head_lr': 0.00016317398002559875}.
[I 2026-03-15 15:29:48,452] Trial 17 finished with values: [0.8402014652014652, 0.7096774193543457, 0.4975505673781926] and parameters: {'lr': 3.0549770625486873e-05, 'weight_decay': 1.0568584062233313e-05, 'label_smoothing': 0.07013985108289447, 'mixup_alpha': 0.13023387101575112, 'cutmix_alpha': 0.05717800792488386, 'loss': 'focal', 'focal_alpha': 0.353062113532131, 'focal_gamma': 2.118404208305278, 'optimizer': 'adam', 'scheduler': 'plateau', 'warmup_epochs': 0.9834946368917719, 'drop_path_rate': 0.19193220279936318, 'grad_clip_norm': 1.0, 'head_lr': 0.00016317398002559875}.
[I 2026-03-15 15:30:25,829] Trial 18 finished with values: [0.8576007326007326, 0.6590909090904256, 0.524855060681381] and parameters: {'lr': 3.0549770625486873e-05, 'weight_decay': 0.00031237281707197285, 'label_smoothing': 0.07013985108289447, 'mixup_alpha': 0.03838741029782664, 'cutmix_alpha': 0.1758578423539238, 'loss': 'focal', 'focal_alpha': 0.353062113532131, 'focal_gamma': 2.2737744505229474, 'optimizer': 'adamw', 'scheduler': 'warmup_cosine', 'warmup_epochs': 0.8281836023531184, 'drop_path_rate': 0.03003669893377634, 'grad_clip_norm': 1.0, 'head_lr': 0.0018067510266103182}.
[I 2026-03-15 15:31:03,804] Trial 19 finished with values: [0.8720238095238095, 0.7551020408158282, 0.4814859436881299] and parameters: {'lr': 5.953998939817118e-05, 'weight_decay': 1.0568584062233313e-05, 'label_smoothing': 0.09404998208578935, 'mixup_alpha': 0.0624154356805998, 'cutmix_alpha': 0.07092152536982073, 'loss': 'focal', 'focal_alpha': 0.3255538863943984, 'focal_gamma': 2.118404208305278, 'optimizer': 'adam', 'scheduler': 'plateau', 'warmup_epochs': 0.04104164931342402, 'drop_path_rate': 0.19193220279936318, 'grad_clip_norm': 1.0, 'head_lr': 0.00027253458113737705}.
[I 2026-03-15 15:31:41,402] Trial 20 finished with values: [0.8070054945054945, 0.38805970149218977, 0.5894752917384903] and parameters: {'lr': 0.0010645160333653384, 'weight_decay': 0.00031237281707197285, 'label_smoothing': 0.07013985108289447, 'mixup_alpha': 0.13023387101575112, 'cutmix_alpha': 0.1758578423539238, 'loss': 'ce', 'focal_alpha': 0.353062113532131, 'focal_gamma': 2.118404208305278, 'optimizer': 'adamw', 'scheduler': 'warmup_cosine', 'warmup_epochs': 1.218987315987007, 'drop_path_rate': 0.03003669893377634, 'grad_clip_norm': 1.0, 'head_lr': 0.0018067510266103182}.
[I 2026-03-15 15:32:19,217] Trial 21 finished with values: [0.899496336996337, 0.7843137254896961, 0.39273939320289547] and parameters: {'lr': 5.953998939817118e-05, 'weight_decay': 3.819359486217119e-06, 'label_smoothing': 0.05467354300782886, 'mixup_alpha': 0.0624154356805998, 'cutmix_alpha': 0.07092152536982073, 'loss': 'ce', 'focal_alpha': 0.3255538863943984, 'focal_gamma': 1.6349871897736725, 'optimizer': 'adamw', 'scheduler': 'none', 'warmup_epochs': 0.3972472275176979, 'drop_path_rate': 0.18633654894059115, 'grad_clip_norm': 0.5, 'head_lr': 0.00027253458113737705}.
[I 2026-03-15 15:32:57,313] Trial 22 finished with values: [0.8949175824175825, 0.7676767676762689, 0.455442653744293] and parameters: {'lr': 0.00039038155563885353, 'weight_decay': 0.00031237281707197285, 'label_smoothing': 0.10582101578944057, 'mixup_alpha': 0.13023387101575112, 'cutmix_alpha': 0.1758578423539238, 'loss': 'focal', 'focal_alpha': 0.32206096955959296, 'focal_gamma': 2.477056294619471, 'optimizer': 'adamw', 'scheduler': 'plateau', 'warmup_epochs': 1.007858232895831, 'drop_path_rate': 0.10525103346997158, 'grad_clip_norm': 1.0, 'head_lr': 0.0006368008499365697}.
[I 2026-03-15 15:33:31,882] Trial 23 finished with values: [0.8772893772893774, 0.7578947368416098, 0.6134348113803451] and parameters: {'lr': 8.929760802149442e-05, 'weight_decay': 1.250309443757088e-05, 'label_smoothing': 0.0852591229193136, 'mixup_alpha': 0.07512721400975991, 'cutmix_alpha': 0.05033661753094809, 'loss': 'focal', 'focal_alpha': 0.32206096955959296, 'focal_gamma': 2.477056294619471, 'optimizer': 'adam', 'scheduler': 'plateau', 'warmup_epochs': 1.007858232895831, 'drop_path_rate': 0.04512752130412789, 'grad_clip_norm': 0.5, 'head_lr': 0.0006368008499365697}.
100%|██████████████████████████████████████████████████████████████████████████████████████████████████████████████████████████████████████████████████████| 24/24 [15:38<00:00, 39.09s/it]
[MOO] Feasible Pareto trials meeting constraints: 0/2 (prec≥0.80, f1≥0.80, auc≥0.80)
[MOO][WARN] No Pareto trials satisfied constraints; falling back to --moo_selection_strategy on the full Pareto front.
    [MOO] Using selected Pareto config #0 for training: {'lr': 0.00039038155563885353, 'weight_decay': 1.250309443757088e-05, 'label_smoothing': 0.07013985108289447, 'mixup_alpha': 0.13023387101575112, 'cutmix_alpha': 0.1758578423539238, 'loss': 'focal', 'focal_alpha': 0.32206096955959296, 'focal_gamma': 2.477056294619471, 'optimizer': 'adamw', 'scheduler': 'plateau', 'warmup_epochs': 1.007858232895831, 'drop_path_rate': 0.10525103346997158, 'grad_clip_norm': 1.0, 'head_lr': 0.0006368008499365697}
    Ep 1: loss=0.0373/0.0664 acc=0.7574 prec=0.8065 rec=0.4808 f1=0.6024 auc=0.8249 thr=0.386(val_thr)
    Ep 2: loss=0.0253/1.2017 acc=0.7647 prec=0.8333 rec=0.4808 f1=0.6098 auc=0.8294 thr=0.542(val_thr)
    Ep 3: loss=0.0186/0.0904 acc=0.8088 prec=0.8250 rec=0.6346 f1=0.7174 auc=0.8500 thr=0.561(val_thr)
    Ep 4: loss=0.0200/0.0643 acc=0.7721 prec=0.8387 rec=0.5000 f1=0.6265 auc=0.8638 thr=0.517(val_thr)
    Ep 5: loss=0.0114/0.1099 acc=0.8603 prec=0.8511 rec=0.7692 f1=0.8081 auc=0.8915 thr=0.148(val_thr)
    Ep 6: loss=0.0152/0.0917 acc=0.7721 prec=0.8000 rec=0.5385 f1=0.6437 auc=0.8464 thr=0.731(val_thr)
    Ep 7: loss=0.0146/0.0544 acc=0.8382 prec=0.8000 rec=0.7692 f1=0.7843 auc=0.9027 thr=0.377(val_thr)
    Ep 8: loss=0.0058/0.0683 acc=0.8162 prec=0.8462 rec=0.6346 f1=0.7253 auc=0.9025 thr=0.363(val_thr)
    Ep 9: loss=0.0042/0.1671 acc=0.8015 prec=0.8049 rec=0.6346 f1=0.7097 auc=0.8542 thr=0.222(val_thr)
    Early stopping at epoch 9.
    [FineTune] ORIGINAL-only for 5 epochs @ lr=1e-05
    [FineTune] Ep 1: loss=0.0085/0.0706
    [FineTune] Ep 2: loss=0.0069/0.0573
    [FineTune] Ep 3: loss=0.0039/0.0727
    [FineTune] Ep 4: loss=0.0040/0.0641
    [FineTune] Ep 5: loss=0.0059/0.0795
    Temperature scaling enabled: T=1.0626 (fit on validation)
    Using validation-tuned threshold 0.393 (val_prec=0.864, val_rec=0.731, val_f1=0.792) for test eval
    FINAL (efficientnetv2_s, fold=0) [thr=0.393 (val_thr)] acc=0.8245 prec=0.8429 rec=0.7284 f1=0.7815 auc=0.8794

  Model: convnext_tiny (224x224)
    [MOO] Optuna(NSGA-II) for convnext_tiny -> outputs_mpox_balanced\fold_0\convnext_tiny\moo
    [MOO] objectives=['auc', 'f1_at_precision', 'logloss'] directions=['maximize', 'maximize', 'minimize']
    [MOO] pop=8 gens=3 trials=24 eval_epochs=6
[I 2026-03-15 15:36:51,352] A new study created in memory with name: moo_convnext_tiny_20260315_153651
[I 2026-03-15 15:38:11,407] Trial 0 finished with values: [0.5940934065934066, 0.03773584905656675, 0.6775427365329024] and parameters: {'lr': 0.002008037330173894, 'weight_decay': 1.2591462178530709e-05, 'label_smoothing': 0.027587821751564167, 'mixup_alpha': 0.08182411142121589, 'cutmix_alpha': 0.22709001163267467, 'loss': 'focal', 'focal_alpha': 0.3459531290614713, 'focal_gamma': 2.3722665938347793, 'optimizer': 'adam', 'scheduler': 'none', 'warmup_epochs': 0.5974074275387631, 'drop_path_rate': 0.131282236616454, 'grad_clip_norm': 1.0, 'head_lr': 0.0006203779517599349}.
