[I 2026-03-15 15:38:51,909] Trial 1 finished with values: [0.8905677655677655, 0.7234042553186545, 0.41075184138029935] and parameters: {'lr': 0.00039038155563885353, 'weight_decay': 0.00031237281707197285, 'label_smoothing': 0.07013985108289447, 'mixup_alpha': 0.13023387101575112, 'cutmix_alpha': 0.1758578423539238, 'loss': 'focal', 'focal_alpha': 0.353062113532131, 'focal_gamma': 2.477056294619471, 'optimizer': 'adamw', 'scheduler': 'plateau', 'warmup_epochs': 0.9834946368917719, 'drop_path_rate': 0.10525103346997158, 'grad_clip_norm': 1.0, 'head_lr': 0.0006368008499365697}.
[I 2026-03-15 15:39:32,374] Trial 2 finished with values: [0.6167582417582418, 0.0, 0.6575060476158892] and parameters: {'lr': 0.0010645160333653384, 'weight_decay': 5.487002599870537e-05, 'label_smoothing': 0.12152841132048821, 'mixup_alpha': 0.03838741029782664, 'cutmix_alpha': 0.08758001749283739, 'loss': 'focal', 'focal_alpha': 0.2878119607810443, 'focal_gamma': 2.2737744505229474, 'optimizer': 'adam', 'scheduler': 'warmup_cosine', 'warmup_epochs': 1.218987315987007, 'drop_path_rate': 0.03003669893377634, 'grad_clip_norm': 1.0, 'head_lr': 0.0018067510266103182}.
[I 2026-03-15 15:40:12,927] Trial 3 finished with values: [0.8862179487179487, 0.7234042553186545, 0.5721913834871303] and parameters: {'lr': 8.929760802149442e-05, 'weight_decay': 1.250309443757088e-05, 'label_smoothing': 0.0852591229193136, 'mixup_alpha': 0.07512721400975991, 'cutmix_alpha': 0.05033661753094809, 'loss': 'focal', 'focal_alpha': 0.32206096955959296, 'focal_gamma': 2.9330749539987124, 'optimizer': 'adam', 'scheduler': 'warmup_cosine', 'warmup_epochs': 1.007858232895831, 'drop_path_rate': 0.04512752130412789, 'grad_clip_norm': 0.5, 'head_lr': 0.0018484086339045946}.
[I 2026-03-15 15:40:52,660] Trial 4 finished with values: [0.5876831501831502, 0.0, 0.6890248535377383] and parameters: {'lr': 0.002196851309214333, 'weight_decay': 7.146824531193168e-05, 'label_smoothing': 0.037873889183614, 'mixup_alpha': 0.2883448232699392, 'cutmix_alpha': 0.14697550551783092, 'loss': 'ce', 'focal_alpha': 0.2560696940238141, 'focal_gamma': 2.127129466558014, 'optimizer': 'adam', 'scheduler': 'warmup_cosine', 'warmup_epochs': 0.21464582440208835, 'drop_path_rate': 0.18214507119308054, 'grad_clip_norm': 1.0, 'head_lr': 1.2758834036187525e-05}.
[I 2026-03-15 15:41:33,080] Trial 5 finished with values: [0.8802655677655677, 0.7843137254896961, 0.4499823737449391] and parameters: {'lr': 3.0549770625486873e-05, 'weight_decay': 1.0568584062233313e-05, 'label_smoothing': 0.09404998208578935, 'mixup_alpha': 0.034489242049100845, 'cutmix_alpha': 0.05717800792488386, 'loss': 'focal', 'focal_alpha': 0.4069877432369666, 'focal_gamma': 2.118404208305278, 'optimizer': 'adam', 'scheduler': 'plateau', 'warmup_epochs': 0.04104164931342402, 'drop_path_rate': 0.19193220279936318, 'grad_clip_norm': 1.0, 'head_lr': 0.00016317398002559875}.
[I 2026-03-15 15:42:13,847] Trial 6 finished with values: [0.5744047619047619, 0.0, 0.678074958362568] and parameters: {'lr': 0.001972552157600415, 'weight_decay': 6.219801441815397e-05, 'label_smoothing': 0.010823982260539683, 'mixup_alpha': 0.22700331927962544, 'cutmix_alpha': 0.24609727348949773, 'loss': 'ce', 'focal_alpha': 0.229331992372645, 'focal_gamma': 0.7434829134144465, 'optimizer': 'adamw', 'scheduler': 'warmup_cosine', 'warmup_epochs': 1.4596228465823389, 'drop_path_rate': 0.08287020343790914, 'grad_clip_norm': 0.5, 'head_lr': 2.565773841975759e-05}.
[I 2026-03-15 15:42:54,377] Trial 7 finished with values: [0.8779761904761905, 0.8076923076918077, 0.42009501586857845] and parameters: {'lr': 5.953998939817118e-05, 'weight_decay': 0.00013314685368433056, 'label_smoothing': 0.05467354300782886, 'mixup_alpha': 0.0624154356805998, 'cutmix_alpha': 0.07092152536982073, 'loss': 'ce', 'focal_alpha': 0.3255538863943984, 'focal_gamma': 1.6349871897736725, 'optimizer': 'adam', 'scheduler': 'none', 'warmup_epochs': 0.3972472275176979, 'drop_path_rate': 0.18633654894059115, 'grad_clip_norm': 0.5, 'head_lr': 0.00027253458113737705}.
[I 2026-03-15 15:43:34,944] Trial 8 finished with values: [0.5761217948717948, 0.0, 0.6974811736044044] and parameters: {'lr': 0.0010645160333653384, 'weight_decay': 5.487002599870537e-05, 'label_smoothing': 0.12152841132048821, 'mixup_alpha': 0.03838741029782664, 'cutmix_alpha': 0.08758001749283739, 'loss': 'focal', 'focal_alpha': 0.2878119607810443, 'focal_gamma': 2.2737744505229474, 'optimizer': 'adamw', 'scheduler': 'warmup_cosine', 'warmup_epochs': 1.218987315987007, 'drop_path_rate': 0.074724092746879, 'grad_clip_norm': 1.0, 'head_lr': 0.0018067510266103182}.
[I 2026-03-15 15:44:15,767] Trial 9 finished with values: [0.88507326007326, 0.8269230769225768, 0.4393731351983405] and parameters: {'lr': 3.0549770625486873e-05, 'weight_decay': 0.00031237281707197285, 'label_smoothing': 0.07013985108289447, 'mixup_alpha': 0.13023387101575112, 'cutmix_alpha': 0.1758578423539238, 'loss': 'focal', 'focal_alpha': 0.353062113532131, 'focal_gamma': 2.118404208305278, 'optimizer': 'adamw', 'scheduler': 'plateau', 'warmup_epochs': 0.9834946368917719, 'drop_path_rate': 0.19193220279936318, 'grad_clip_norm': 1.0, 'head_lr': 0.0006368008499365697}.
[I 2026-03-15 15:44:56,258] Trial 10 finished with values: [0.8447802197802198, 0.6024096385537487, 0.8869755241870586] and parameters: {'lr': 0.00039038155563885353, 'weight_decay': 1.250309443757088e-05, 'label_smoothing': 0.07013985108289447, 'mixup_alpha': 0.13023387101575112, 'cutmix_alpha': 0.1758578423539238, 'loss': 'focal', 'focal_alpha': 0.32206096955959296, 'focal_gamma': 2.477056294619471, 'optimizer': 'adamw', 'scheduler': 'plateau', 'warmup_epochs': 1.007858232895831, 'drop_path_rate': 0.10525103346997158, 'grad_clip_norm': 1.0, 'head_lr': 0.0006368008499365697}.
[I 2026-03-15 15:45:36,958] Trial 11 finished with values: [0.8940018315018315, 0.7920792079202925, 0.5017690560772123] and parameters: {'lr': 5.953998939817118e-05, 'weight_decay': 5.487002599870537e-05, 'label_smoothing': 0.12152841132048821, 'mixup_alpha': 0.03838741029782664, 'cutmix_alpha': 0.08758001749283739, 'loss': 'focal', 'focal_alpha': 0.3255538863943984, 'focal_gamma': 2.2737744505229474, 'optimizer': 'adam', 'scheduler': 'warmup_cosine', 'warmup_epochs': 0.8281836023531184, 'drop_path_rate': 0.03003669893377634, 'grad_clip_norm': 1.0, 'head_lr': 0.0018067510266103182}.
[I 2026-03-15 15:46:17,627] Trial 12 finished with values: [0.576007326007326, 0.07407407407400274, 0.6708286188570911] and parameters: {'lr': 0.002008037330173894, 'weight_decay': 1.0568584062233313e-05, 'label_smoothing': 0.09058608508710066, 'mixup_alpha': 0.08182411142121589, 'cutmix_alpha': 0.268699490942095, 'loss': 'focal', 'focal_alpha': 0.4069877432369666, 'focal_gamma': 2.3722665938347793, 'optimizer': 'adam', 'scheduler': 'none', 'warmup_epochs': 0.5974074275387631, 'drop_path_rate': 0.131282236616454, 'grad_clip_norm': 1.0, 'head_lr': 0.0006203779517599349}.
[I 2026-03-15 15:46:58,449] Trial 13 finished with values: [0.59375, 0.0, 0.7450759342630616] and parameters: {'lr': 0.001972552157600415, 'weight_decay': 0.00031237281707197285, 'label_smoothing': 0.010823982260539683, 'mixup_alpha': 0.13023387101575112, 'cutmix_alpha': 0.24609727348949773, 'loss': 'focal', 'focal_alpha': 0.353062113532131, 'focal_gamma': 2.477056294619471, 'optimizer': 'adamw', 'scheduler': 'none', 'warmup_epochs': 0.9834946368917719, 'drop_path_rate': 0.08287020343790914, 'grad_clip_norm': 0.5, 'head_lr': 2.565773841975759e-05}.
[I 2026-03-15 15:47:39,085] Trial 14 finished with values: [0.8846153846153846, 0.7799999999995008, 0.5791745289399399] and parameters: {'lr': 5.953998939817118e-05, 'weight_decay': 0.00013314685368433056, 'label_smoothing': 0.05467354300782886, 'mixup_alpha': 0.0624154356805998, 'cutmix_alpha': 0.07092152536982073, 'loss': 'ce', 'focal_alpha': 0.3255538863943984, 'focal_gamma': 1.6349871897736725, 'optimizer': 'adam', 'scheduler': 'none', 'warmup_epochs': 0.3972472275176979, 'drop_path_rate': 0.18633654894059115, 'grad_clip_norm': 0.5, 'head_lr': 0.00027253458113737705}.
[I 2026-03-15 15:48:19,878] Trial 15 finished with values: [0.8628663003663004, 0.7843137254896961, 0.5873263263674076] and parameters: {'lr': 8.929760802149442e-05, 'weight_decay': 7.146824531193168e-05, 'label_smoothing': 0.10972157340566355, 'mixup_alpha': 0.07512721400975991, 'cutmix_alpha': 0.05033661753094809, 'loss': 'focal', 'focal_alpha': 0.2560696940238141, 'focal_gamma': 2.9330749539987124, 'optimizer': 'adam', 'scheduler': 'warmup_cosine', 'warmup_epochs': 0.21464582440208835, 'drop_path_rate': 0.18214507119308054, 'grad_clip_norm': 1.0, 'head_lr': 1.2758834036187525e-05}.
[I 2026-03-15 15:49:00,032] Trial 16 finished with values: [0.894459706959707, 0.7843137254896961, 0.5041665718078815] and parameters: {'lr': 5.953998939817118e-05, 'weight_decay': 0.00031237281707197285, 'label_smoothing': 0.05467354300782886, 'mixup_alpha': 0.0624154356805998, 'cutmix_alpha': 0.07092152536982073, 'loss': 'ce', 'focal_alpha': 0.3255538863943984, 'focal_gamma': 1.6349871897736725, 'optimizer': 'adam', 'scheduler': 'none', 'warmup_epochs': 0.9834946368917719, 'drop_path_rate': 0.18633654894059115, 'grad_clip_norm': 0.5, 'head_lr': 0.00027253458113737705}.
[I 2026-03-15 15:49:40,249] Trial 17 finished with values: [0.8843864468864469, 0.6666666666661858, 0.5330623802349315] and parameters: {'lr': 5.953998939817118e-05, 'weight_decay': 0.00031237281707197285, 'label_smoothing': 0.12152841132048821, 'mixup_alpha': 0.03838741029782664, 'cutmix_alpha': 0.1758578423539238, 'loss': 'focal', 'focal_alpha': 0.3255538863943984, 'focal_gamma': 2.2737744505229474, 'optimizer': 'adamw', 'scheduler': 'warmup_cosine', 'warmup_epochs': 0.8281836023531184, 'drop_path_rate': 0.03003669893377634, 'grad_clip_norm': 1.0, 'head_lr': 0.0006368008499365697}.
[I 2026-03-15 15:50:20,325] Trial 18 finished with values: [0.8690476190476191, 0.762886597937647, 0.5180842237564426] and parameters: {'lr': 5.953998939817118e-05, 'weight_decay': 5.487002599870537e-05, 'label_smoothing': 0.12152841132048821, 'mixup_alpha': 0.13023387101575112, 'cutmix_alpha': 0.08758001749283739, 'loss': 'focal', 'focal_alpha': 0.3255538863943984, 'focal_gamma': 2.118404208305278, 'optimizer': 'adam', 'scheduler': 'warmup_cosine', 'warmup_epochs': 0.9834946368917719, 'drop_path_rate': 0.19193220279936318, 'grad_clip_norm': 1.0, 'head_lr': 0.0006368008499365697}.
[I 2026-03-15 15:51:00,619] Trial 19 finished with values: [0.8795787545787546, 0.6823529411759957, 0.4291740067023653] and parameters: {'lr': 3.0549770625486873e-05, 'weight_decay': 0.00013314685368433056, 'label_smoothing': 0.05467354300782886, 'mixup_alpha': 0.13023387101575112, 'cutmix_alpha': 0.1758578423539238, 'loss': 'ce', 'focal_alpha': 0.353062113532131, 'focal_gamma': 1.6349871897736725, 'optimizer': 'adam', 'scheduler': 'none', 'warmup_epochs': 0.3972472275176979, 'drop_path_rate': 0.18633654894059115, 'grad_clip_norm': 0.5, 'head_lr': 0.0006368008499365697}.
[I 2026-03-15 15:51:41,222] Trial 20 finished with values: [0.9029304029304029, 0.8224299065415565, 0.7224175470417985] and parameters: {'lr': 8.929760802149442e-05, 'weight_decay': 5.487002599870537e-05, 'label_smoothing': 0.12152841132048821, 'mixup_alpha': 0.03838741029782664, 'cutmix_alpha': 0.08758001749283739, 'loss': 'ce', 'focal_alpha': 0.3255538863943984, 'focal_gamma': 2.2737744505229474, 'optimizer': 'adam', 'scheduler': 'warmup_cosine', 'warmup_epochs': 1.007858232895831, 'drop_path_rate': 0.04512752130412789, 'grad_clip_norm': 0.5, 'head_lr': 0.0018484086339045946}.
[I 2026-03-15 15:52:21,978] Trial 21 finished with values: [0.9235347985347986, 0.8514851485143518, 0.33162790247563717] and parameters: {'lr': 3.0549770625486873e-05, 'weight_decay': 3.819359486217119e-06, 'label_smoothing': 0.07013985108289447, 'mixup_alpha': 0.13023387101575112, 'cutmix_alpha': 0.1758578423539238, 'loss': 'focal', 'focal_alpha': 0.353062113532131, 'focal_gamma': 2.118404208305278, 'optimizer': 'adamw', 'scheduler': 'plateau', 'warmup_epochs': 0.9834946368917719, 'drop_path_rate': 0.19193220279936318, 'grad_clip_norm': 1.0, 'head_lr': 0.0006368008499365697}.
[I 2026-03-15 15:53:02,624] Trial 22 finished with values: [0.8983516483516483, 0.8118811881183122, 0.4542492664581136] and parameters: {'lr': 5.953998939817118e-05, 'weight_decay': 5.487002599870537e-05, 'label_smoothing': 0.10582101578944057, 'mixup_alpha': 0.0624154356805998, 'cutmix_alpha': 0.07092152536982073, 'loss': 'ce', 'focal_alpha': 0.3255538863943984, 'focal_gamma': 1.6349871897736725, 'optimizer': 'adam', 'scheduler': 'warmup_cosine', 'warmup_epochs': 0.3972472275176979, 'drop_path_rate': 0.18633654894059115, 'grad_clip_norm': 0.5, 'head_lr': 0.00027253458113737705}.
[I 2026-03-15 15:53:42,837] Trial 23 finished with values: [0.8717948717948718, 0.7741935483866036, 0.45874485393850745] and parameters: {'lr': 3.0549770625486873e-05, 'weight_decay': 0.00031237281707197285, 'label_smoothing': 0.09404998208578935, 'mixup_alpha': 0.034489242049100845, 'cutmix_alpha': 0.05717800792488386, 'loss': 'focal', 'focal_alpha': 0.4069877432369666, 'focal_gamma': 2.118404208305278, 'optimizer': 'adam', 'scheduler': 'plateau', 'warmup_epochs': 0.04104164931342402, 'drop_path_rate': 0.19193220279936318, 'grad_clip_norm': 1.0, 'head_lr': 0.0006368008499365697}.
100%|██████████████████████████████████████████████████████████████████████████████████████████████████████████████████████████████████████████████████████| 24/24 [16:51<00:00, 42.15s/it]
[MOO] Feasible Pareto trials meeting constraints: 1/1 (prec≥0.80, f1≥0.80, auc≥0.80)
    [MOO] Using selected Pareto config #0 for training: {'lr': 3.0549770625486873e-05, 'weight_decay': 3.819359486217119e-06, 'label_smoothing': 0.07013985108289447, 'mixup_alpha': 0.13023387101575112, 'cutmix_alpha': 0.1758578423539238, 'loss': 'focal', 'focal_alpha': 0.353062113532131, 'focal_gamma': 2.118404208305278, 'optimizer': 'adamw', 'scheduler': 'plateau', 'warmup_epochs': 0.9834946368917719, 'drop_path_rate': 0.19193220279936318, 'grad_clip_norm': 1.0, 'head_lr': 0.0006368008499365697}
    Ep 1: loss=0.0510/0.0500 acc=0.8088 prec=0.8095 rec=0.6538 f1=0.7234 auc=0.8727 thr=0.530(val_thr)
    Ep 2: loss=0.0311/0.0624 acc=0.7941 prec=0.9000 rec=0.5192 f1=0.6585 auc=0.8503 thr=0.440(val_thr)
    Ep 3: loss=0.0190/0.0480 acc=0.8309 prec=0.8085 rec=0.7308 f1=0.7677 auc=0.8977 thr=0.452(val_thr)
    Ep 4: loss=0.0088/0.0682 acc=0.8162 prec=0.8140 rec=0.6731 f1=0.7368 auc=0.8835 thr=0.428(val_thr)
    Ep 5: loss=0.0052/0.0722 acc=0.8162 prec=0.8462 rec=0.6346 f1=0.7253 auc=0.8864 thr=0.475(val_thr)
    Ep 6: loss=0.0023/0.0875 acc=0.8088 prec=0.8250 rec=0.6346 f1=0.7174 auc=0.8729 thr=0.436(val_thr)
    Ep 7: loss=0.0027/0.0887 acc=0.7941 prec=0.8158 rec=0.5962 f1=0.6889 auc=0.8716 thr=0.469(val_thr)
    Early stopping at epoch 7.
    [FineTune] ORIGINAL-only for 5 epochs @ lr=1e-05
    [FineTune] Ep 1: loss=0.0081/0.0581
    [FineTune] Ep 2: loss=0.0061/0.0632
    [FineTune] Ep 3: loss=0.0049/0.0702
    [FineTune] Ep 4: loss=0.0036/0.0781
    [FineTune] Ep 5: loss=0.0042/0.0738
    Temperature scaling enabled: T=0.7834 (fit on validation)
    Using validation-tuned threshold 0.397 (val_prec=0.809, val_rec=0.731, val_f1=0.768) for test eval
    FINAL (convnext_tiny, fold=0) [thr=0.397 (val_thr)] acc=0.8404 prec=0.8228 rec=0.8025 f1=0.8125 auc=0.9230

  Model: vit_b_16 (224x224)
    [MOO] Optuna(NSGA-II) for vit_b_16 -> outputs_mpox_balanced\fold_0\vit_b_16\moo
    [MOO] objectives=['auc', 'f1_at_precision', 'logloss'] directions=['maximize', 'maximize', 'minimize']
    [MOO] pop=8 gens=3 trials=24 eval_epochs=6
[I 2026-03-15 15:56:08,429] A new study created in memory with name: moo_vit_b_16_20260315_155608
  0%|                                                                                                                                                               | 0/24 [00:00<?, ?it/s]D:\Ibrahim\Lymphedema-GP-CUFE\Manuscript\lymph_env\lib\site-packages\torch\nn\functional.py:5560: UserWarning: 1Torch was not compiled with flash attention. (Triggered internally at C:\actions-runner\_work\pytorch\pytorch\builder\windows\pytorch\aten\src\ATen\native\transformers\cuda\sdp_utils.cpp:555.)
  attn_output = scaled_dot_product_attention(q, k, v, attn_mask, dropout_p, is_causal)
[I 2026-03-15 15:58:03,685] Trial 0 finished with values: [0.5874542124542125, 0.03773584905656675, 0.6617115585370241] and parameters: {'lr': 0.002008037330173894, 'weight_decay': 1.2591462178530709e-05, 'label_smoothing': 0.027587821751564167, 'mixup_alpha': 0.08182411142121589, 'cutmix_alpha': 0.22709001163267467, 'loss': 'focal', 'focal_alpha': 0.3459531290614713, 'focal_gamma': 2.3722665938347793, 'optimizer': 'adam', 'scheduler': 'none', 'warmup_epochs': 0.5974074275387631, 'drop_path_rate': 0.131282236616454, 'grad_clip_norm': 1.0, 'head_lr': 0.0006203779517599349}.
[I 2026-03-15 15:59:19,172] Trial 1 finished with values: [0.6201923076923077, 0.03773584905656675, 0.675414095986731] and parameters: {'lr': 0.00039038155563885353, 'weight_decay': 0.00031237281707197285, 'label_smoothing': 0.07013985108289447, 'mixup_alpha': 0.13023387101575112, 'cutmix_alpha': 0.1758578423539238, 'loss': 'focal', 'focal_alpha': 0.353062113532131, 'focal_gamma': 2.477056294619471, 'optimizer': 'adamw', 'scheduler': 'plateau', 'warmup_epochs': 0.9834946368917719, 'drop_path_rate': 0.10525103346997158, 'grad_clip_norm': 1.0, 'head_lr': 0.0006368008499365697}.
[I 2026-03-15 16:00:34,734] Trial 2 finished with values: [0.6263736263736264, 0.03773584905656675, 0.6652181606263935] and parameters: {'lr': 0.0010645160333653384, 'weight_decay': 5.487002599870537e-05, 'label_smoothing': 0.12152841132048821, 'mixup_alpha': 0.03838741029782664, 'cutmix_alpha': 0.08758001749283739, 'loss': 'focal', 'focal_alpha': 0.2878119607810443, 'focal_gamma': 2.2737744505229474, 'optimizer': 'adam', 'scheduler': 'warmup_cosine', 'warmup_epochs': 1.218987315987007, 'drop_path_rate': 0.03003669893377634, 'grad_clip_norm': 1.0, 'head_lr': 0.0018067510266103182}.
[I 2026-03-15 16:01:50,606] Trial 3 finished with values: [0.848901098901099, 0.7368421052626624, 0.492561854453107] and parameters: {'lr': 8.929760802149442e-05, 'weight_decay': 1.250309443757088e-05, 'label_smoothing': 0.0852591229193136, 'mixup_alpha': 0.07512721400975991, 'cutmix_alpha': 0.05033661753094809, 'loss': 'focal', 'focal_alpha': 0.32206096955959296, 'focal_gamma': 2.9330749539987124, 'optimizer': 'adam', 'scheduler': 'warmup_cosine', 'warmup_epochs': 1.007858232895831, 'drop_path_rate': 0.04512752130412789, 'grad_clip_norm': 0.5, 'head_lr': 0.0018484086339045946}.
[I 2026-03-15 16:03:05,996] Trial 4 finished with values: [0.5002289377289377, 0.0, 0.6692004640507703] and parameters: {'lr': 0.002196851309214333, 'weight_decay': 7.146824531193168e-05, 'label_smoothing': 0.037873889183614, 'mixup_alpha': 0.2883448232699392, 'cutmix_alpha': 0.14697550551783092, 'loss': 'ce', 'focal_alpha': 0.2560696940238141, 'focal_gamma': 2.127129466558014, 'optimizer': 'adam', 'scheduler': 'warmup_cosine', 'warmup_epochs': 0.21464582440208835, 'drop_path_rate': 0.18214507119308054, 'grad_clip_norm': 1.0, 'head_lr': 1.2758834036187525e-05}.
[I 2026-03-15 16:04:21,703] Trial 5 finished with values: [0.8853021978021978, 0.7961165048538689, 0.445158046515254] and parameters: {'lr': 3.0549770625486873e-05, 'weight_decay': 1.0568584062233313e-05, 'label_smoothing': 0.09404998208578935, 'mixup_alpha': 0.034489242049100845, 'cutmix_alpha': 0.05717800792488386, 'loss': 'focal', 'focal_alpha': 0.4069877432369666, 'focal_gamma': 2.118404208305278, 'optimizer': 'adam', 'scheduler': 'plateau', 'warmup_epochs': 0.04104164931342402, 'drop_path_rate': 0.19193220279936318, 'grad_clip_norm': 1.0, 'head_lr': 0.00016317398002559875}.
[I 2026-03-15 16:05:37,183] Trial 6 finished with values: [0.6128663003663004, 0.03773584905656675, 0.6978463840777471] and parameters: {'lr': 0.001972552157600415, 'weight_decay': 6.219801441815397e-05, 'label_smoothing': 0.010823982260539683, 'mixup_alpha': 0.22700331927962544, 'cutmix_alpha': 0.24609727348949773, 'loss': 'ce', 'focal_alpha': 0.229331992372645, 'focal_gamma': 0.7434829134144465, 'optimizer': 'adamw', 'scheduler': 'warmup_cosine', 'warmup_epochs': 1.4596228465823389, 'drop_path_rate': 0.08287020343790914, 'grad_clip_norm': 0.5, 'head_lr': 2.565773841975759e-05}.
[I 2026-03-15 16:06:52,841] Trial 7 finished with values: [0.8784340659340659, 0.6913580246908982, 0.5397271887362762] and parameters: {'lr': 5.953998939817118e-05, 'weight_decay': 0.00013314685368433056, 'label_smoothing': 0.05467354300782886, 'mixup_alpha': 0.0624154356805998, 'cutmix_alpha': 0.07092152536982073, 'loss': 'ce', 'focal_alpha': 0.3255538863943984, 'focal_gamma': 1.6349871897736725, 'optimizer': 'adam', 'scheduler': 'none', 'warmup_epochs': 0.3972472275176979, 'drop_path_rate': 0.18633654894059115, 'grad_clip_norm': 0.5, 'head_lr': 0.00027253458113737705}.
[I 2026-03-15 16:08:08,713] Trial 8 finished with values: [0.6053113553113553, 0.0, 0.71675941120203] and parameters: {'lr': 0.00039038155563885353, 'weight_decay': 0.00031237281707197285, 'label_smoothing': 0.07013985108289447, 'mixup_alpha': 0.13023387101575112, 'cutmix_alpha': 0.1758578423539238, 'loss': 'focal', 'focal_alpha': 0.353062113532131, 'focal_gamma': 2.477056294619471, 'optimizer': 'adamw', 'scheduler': 'plateau', 'warmup_epochs': 0.9834946368917719, 'drop_path_rate': 0.074724092746879, 'grad_clip_norm': 1.0, 'head_lr': 0.0006368008499365697}.
