[I 2026-03-15 16:58:51,752] Trial 23 finished with values: [0.9187271062271063, 0.8545454545449561, 0.36818946376648387] and parameters: {'lr': 5.953998939817118e-05, 'weight_decay': 0.00013314685368433056, 'label_smoothing': 0.05467354300782886, 'mixup_alpha': 0.0624154356805998, 'cutmix_alpha': 0.07092152536982073, 'loss': 'ce', 'focal_alpha': 0.3255538863943984, 'focal_gamma': 1.6349871897736725, 'optimizer': 'adam', 'scheduler': 'none', 'warmup_epochs': 0.3972472275176979, 'drop_path_rate': 0.18633654894059115, 'grad_clip_norm': 0.5, 'head_lr': 0.00027253458113737705}.
100%|██████████████████████████████████████████████████████████████████████████████████████████████████████████████████████████████████████████████████████| 24/24 [13:56<00:00, 34.84s/it]
[MOO] Feasible Pareto trials meeting constraints: 1/2 (prec≥0.80, f1≥0.80, auc≥0.80)
    [MOO] Using selected Pareto config #0 for training: {'lr': 5.953998939817118e-05, 'weight_decay': 0.00013314685368433056, 'label_smoothing': 0.05467354300782886, 'mixup_alpha': 0.0624154356805998, 'cutmix_alpha': 0.07092152536982073, 'loss': 'ce', 'focal_alpha': 0.3255538863943984, 'focal_gamma': 1.6349871897736725, 'optimizer': 'adam', 'scheduler': 'none', 'warmup_epochs': 0.3972472275176979, 'drop_path_rate': 0.18633654894059115, 'grad_clip_norm': 0.5, 'head_lr': 0.00027253458113737705}
    Ep 1: loss=0.5547/0.5233 acc=0.7574 prec=0.8800 rec=0.4231 f1=0.5714 auc=0.8329 thr=0.729(val_thr)
    Ep 2: loss=0.4167/0.4457 acc=0.8162 prec=0.8293 rec=0.6538 f1=0.7312 auc=0.8903 thr=0.568(val_thr)
    Ep 3: loss=0.3475/0.4335 acc=0.8235 prec=0.8182 rec=0.6923 f1=0.7500 auc=0.8986 thr=0.507(val_thr)
    Ep 4: loss=0.3267/0.4283 acc=0.8382 prec=0.8409 rec=0.7115 f1=0.7708 auc=0.9084 thr=0.453(val_thr)
    Ep 5: loss=0.2798/0.4281 acc=0.8456 prec=0.8605 rec=0.7115 f1=0.7789 auc=0.8990 thr=0.515(val_thr)
    Ep 6: loss=0.2767/0.4901 acc=0.8235 prec=0.8500 rec=0.6538 f1=0.7391 auc=0.8876 thr=0.412(val_thr)
    Ep 7: loss=0.2635/0.4368 acc=0.8382 prec=0.8750 rec=0.6731 f1=0.7609 auc=0.8988 thr=0.531(val_thr)
    Ep 8: loss=0.2602/0.4587 acc=0.8382 prec=0.9167 rec=0.6346 f1=0.7500 auc=0.8924 thr=0.536(val_thr)
    Ep 9: loss=0.2742/0.4331 acc=0.8529 prec=0.8333 rec=0.7692 f1=0.8000 auc=0.9038 thr=0.351(val_thr)
    Ep 10: loss=0.2810/0.4072 acc=0.8235 prec=0.8043 rec=0.7115 f1=0.7551 auc=0.9121 thr=0.497(val_thr)
    Ep 11: loss=0.2758/0.4134 acc=0.8456 prec=0.8605 rec=0.7115 f1=0.7789 auc=0.9109 thr=0.545(val_thr)
    Ep 12: loss=0.3207/0.4223 acc=0.8309 prec=0.8085 rec=0.7308 f1=0.7677 auc=0.9135 thr=0.340(val_thr)
    Ep 13: loss=0.2729/0.4838 acc=0.8162 prec=0.8462 rec=0.6346 f1=0.7253 auc=0.9089 thr=0.315(val_thr)
    Early stopping at epoch 13.
    [FineTune] ORIGINAL-only for 5 epochs @ lr=1e-05
    [FineTune] Ep 1: loss=0.1537/0.4361
    [FineTune] Ep 2: loss=0.1537/0.4465
    [FineTune] Ep 3: loss=0.1458/0.4515
    [FineTune] Ep 4: loss=0.1388/0.4197
    [FineTune] Ep 5: loss=0.1466/0.4206
    Temperature scaling enabled: T=1.0549 (fit on validation)
    Using validation-tuned threshold 0.439 (val_prec=0.837, val_rec=0.692, val_f1=0.758) for test eval
    FINAL (densenet121, fold=0) [thr=0.439 (val_thr)] acc=0.8245 prec=0.8429 rec=0.7284 f1=0.7815 auc=0.9027

  Model: efficientnet_b0 (224x224)
    [MOO] Optuna(NSGA-II) for efficientnet_b0 -> outputs_mpox_balanced\fold_0\efficientnet_b0\moo
    [MOO] objectives=['auc', 'f1_at_precision', 'logloss'] directions=['maximize', 'maximize', 'minimize']
    [MOO] pop=8 gens=3 trials=24 eval_epochs=6
[I 2026-03-15 17:02:56,978] A new study created in memory with name: moo_efficientnet_b0_20260315_170256
[I 2026-03-15 17:03:57,834] Trial 0 finished with values: [0.8131868131868132, 0.574999999999545, 0.6560663172064675] and parameters: {'lr': 0.002008037330173894, 'weight_decay': 1.2591462178530709e-05, 'label_smoothing': 0.027587821751564167, 'mixup_alpha': 0.08182411142121589, 'cutmix_alpha': 0.22709001163267467, 'loss': 'focal', 'focal_alpha': 0.3459531290614713, 'focal_gamma': 2.3722665938347793, 'optimizer': 'adam', 'scheduler': 'none', 'warmup_epochs': 0.5974074275387631, 'drop_path_rate': 0.131282236616454, 'grad_clip_norm': 1.0, 'head_lr': 0.0006203779517599349}.
[I 2026-03-15 17:04:15,333] Trial 1 finished with values: [0.8553113553113553, 0.695652173912552, 0.5383025285895586] and parameters: {'lr': 0.00039038155563885353, 'weight_decay': 0.00031237281707197285, 'label_smoothing': 0.07013985108289447, 'mixup_alpha': 0.13023387101575112, 'cutmix_alpha': 0.1758578423539238, 'loss': 'focal', 'focal_alpha': 0.353062113532131, 'focal_gamma': 2.477056294619471, 'optimizer': 'adamw', 'scheduler': 'plateau', 'warmup_epochs': 0.9834946368917719, 'drop_path_rate': 0.10525103346997158, 'grad_clip_norm': 1.0, 'head_lr': 0.0006368008499365697}.
[I 2026-03-15 17:04:32,786] Trial 2 finished with values: [0.885989010989011, 0.8076923076918077, 0.434489145296743] and parameters: {'lr': 0.0010645160333653384, 'weight_decay': 5.487002599870537e-05, 'label_smoothing': 0.12152841132048821, 'mixup_alpha': 0.03838741029782664, 'cutmix_alpha': 0.08758001749283739, 'loss': 'focal', 'focal_alpha': 0.2878119607810443, 'focal_gamma': 2.2737744505229474, 'optimizer': 'adam', 'scheduler': 'warmup_cosine', 'warmup_epochs': 1.218987315987007, 'drop_path_rate': 0.03003669893377634, 'grad_clip_norm': 1.0, 'head_lr': 0.0018067510266103182}.
[I 2026-03-15 17:04:49,857] Trial 3 finished with values: [0.8871336996336997, 0.7676767676762689, 0.4089892420352] and parameters: {'lr': 8.929760802149442e-05, 'weight_decay': 1.250309443757088e-05, 'label_smoothing': 0.0852591229193136, 'mixup_alpha': 0.07512721400975991, 'cutmix_alpha': 0.05033661753094809, 'loss': 'focal', 'focal_alpha': 0.32206096955959296, 'focal_gamma': 2.9330749539987124, 'optimizer': 'adam', 'scheduler': 'warmup_cosine', 'warmup_epochs': 1.007858232895831, 'drop_path_rate': 0.04512752130412789, 'grad_clip_norm': 0.5, 'head_lr': 0.0018484086339045946}.
[I 2026-03-15 17:05:06,335] Trial 4 finished with values: [0.6513278388278388, 0.36363636363602936, 0.655663959267675] and parameters: {'lr': 0.002196851309214333, 'weight_decay': 7.146824531193168e-05, 'label_smoothing': 0.037873889183614, 'mixup_alpha': 0.2883448232699392, 'cutmix_alpha': 0.14697550551783092, 'loss': 'ce', 'focal_alpha': 0.2560696940238141, 'focal_gamma': 2.127129466558014, 'optimizer': 'adam', 'scheduler': 'warmup_cosine', 'warmup_epochs': 0.21464582440208835, 'drop_path_rate': 0.18214507119308054, 'grad_clip_norm': 1.0, 'head_lr': 1.2758834036187525e-05}.
[I 2026-03-15 17:05:23,063] Trial 5 finished with values: [0.820054945054945, 0.6511627906971962, 0.5052516138908688] and parameters: {'lr': 3.0549770625486873e-05, 'weight_decay': 1.0568584062233313e-05, 'label_smoothing': 0.09404998208578935, 'mixup_alpha': 0.034489242049100845, 'cutmix_alpha': 0.05717800792488386, 'loss': 'focal', 'focal_alpha': 0.4069877432369666, 'focal_gamma': 2.118404208305278, 'optimizer': 'adam', 'scheduler': 'plateau', 'warmup_epochs': 0.04104164931342402, 'drop_path_rate': 0.19193220279936318, 'grad_clip_norm': 1.0, 'head_lr': 0.00016317398002559875}.
[I 2026-03-15 17:05:40,038] Trial 6 finished with values: [0.7923534798534798, 0.3823529411761107, 0.5829984934398064] and parameters: {'lr': 0.001972552157600415, 'weight_decay': 6.219801441815397e-05, 'label_smoothing': 0.010823982260539683, 'mixup_alpha': 0.22700331927962544, 'cutmix_alpha': 0.24609727348949773, 'loss': 'ce', 'focal_alpha': 0.229331992372645, 'focal_gamma': 0.7434829134144465, 'optimizer': 'adamw', 'scheduler': 'warmup_cosine', 'warmup_epochs': 1.4596228465823389, 'drop_path_rate': 0.08287020343790914, 'grad_clip_norm': 0.5, 'head_lr': 2.565773841975759e-05}.
[I 2026-03-15 17:05:57,083] Trial 7 finished with values: [0.8910256410256411, 0.7708333333328368, 0.3946950186903603] and parameters: {'lr': 5.953998939817118e-05, 'weight_decay': 0.00013314685368433056, 'label_smoothing': 0.05467354300782886, 'mixup_alpha': 0.0624154356805998, 'cutmix_alpha': 0.07092152536982073, 'loss': 'ce', 'focal_alpha': 0.3255538863943984, 'focal_gamma': 1.6349871897736725, 'optimizer': 'adam', 'scheduler': 'none', 'warmup_epochs': 0.3972472275176979, 'drop_path_rate': 0.18633654894059115, 'grad_clip_norm': 0.5, 'head_lr': 0.00027253458113737705}.
[I 2026-03-15 17:06:13,908] Trial 8 finished with values: [0.8415750915750915, 0.6741573033703007, 0.5095669738464927] and parameters: {'lr': 0.002008037330173894, 'weight_decay': 1.2591462178530709e-05, 'label_smoothing': 0.027587821751564167, 'mixup_alpha': 0.08182411142121589, 'cutmix_alpha': 0.22709001163267467, 'loss': 'focal', 'focal_alpha': 0.3459531290614713, 'focal_gamma': 2.3722665938347793, 'optimizer': 'adamw', 'scheduler': 'none', 'warmup_epochs': 0.5974074275387631, 'drop_path_rate': 0.074724092746879, 'grad_clip_norm': 1.0, 'head_lr': 0.0006203779517599349}.
[I 2026-03-15 17:06:30,791] Trial 9 finished with values: [0.8555402930402931, 0.695652173912552, 0.4767398024193956] and parameters: {'lr': 3.0549770625486873e-05, 'weight_decay': 0.00031237281707197285, 'label_smoothing': 0.07013985108289447, 'mixup_alpha': 0.13023387101575112, 'cutmix_alpha': 0.1758578423539238, 'loss': 'focal', 'focal_alpha': 0.353062113532131, 'focal_gamma': 2.118404208305278, 'optimizer': 'adamw', 'scheduler': 'plateau', 'warmup_epochs': 0.9834946368917719, 'drop_path_rate': 0.19193220279936318, 'grad_clip_norm': 1.0, 'head_lr': 0.0006368008499365697}.
[I 2026-03-15 17:06:47,375] Trial 10 finished with values: [0.8802655677655677, 0.7659574468080164, 0.42161301289139447] and parameters: {'lr': 0.00039038155563885353, 'weight_decay': 0.00013314685368433056, 'label_smoothing': 0.07013985108289447, 'mixup_alpha': 0.13023387101575112, 'cutmix_alpha': 0.1758578423539238, 'loss': 'ce', 'focal_alpha': 0.3255538863943984, 'focal_gamma': 2.477056294619471, 'optimizer': 'adamw', 'scheduler': 'plateau', 'warmup_epochs': 0.3972472275176979, 'drop_path_rate': 0.10525103346997158, 'grad_clip_norm': 1.0, 'head_lr': 0.0006368008499365697}.
[I 2026-03-15 17:07:04,143] Trial 11 finished with values: [0.8541666666666667, 0.7234042553186545, 0.4617342379333146] and parameters: {'lr': 5.953998939817118e-05, 'weight_decay': 5.487002599870537e-05, 'label_smoothing': 0.12152841132048821, 'mixup_alpha': 0.03838741029782664, 'cutmix_alpha': 0.08758001749283739, 'loss': 'focal', 'focal_alpha': 0.3255538863943984, 'focal_gamma': 2.2737744505229474, 'optimizer': 'adam', 'scheduler': 'warmup_cosine', 'warmup_epochs': 0.8281836023531184, 'drop_path_rate': 0.03003669893377634, 'grad_clip_norm': 1.0, 'head_lr': 0.0018067510266103182}.
[I 2026-03-15 17:07:21,042] Trial 12 finished with values: [0.6369047619047619, 0.175438596491068, 0.8956985279980021] and parameters: {'lr': 0.002196851309214333, 'weight_decay': 1.0568584062233313e-05, 'label_smoothing': 0.09058608508710066, 'mixup_alpha': 0.2883448232699392, 'cutmix_alpha': 0.268699490942095, 'loss': 'focal', 'focal_alpha': 0.4069877432369666, 'focal_gamma': 2.127129466558014, 'optimizer': 'adam', 'scheduler': 'warmup_cosine', 'warmup_epochs': 0.21464582440208835, 'drop_path_rate': 0.18214507119308054, 'grad_clip_norm': 1.0, 'head_lr': 1.2758834036187525e-05}.
[I 2026-03-15 17:07:38,207] Trial 13 finished with values: [0.8408882783882784, 0.6741573033703007, 0.5829788132252124] and parameters: {'lr': 0.001972552157600415, 'weight_decay': 0.00031237281707197285, 'label_smoothing': 0.010823982260539683, 'mixup_alpha': 0.13023387101575112, 'cutmix_alpha': 0.24609727348949773, 'loss': 'focal', 'focal_alpha': 0.353062113532131, 'focal_gamma': 2.477056294619471, 'optimizer': 'adamw', 'scheduler': 'none', 'warmup_epochs': 0.9834946368917719, 'drop_path_rate': 0.08287020343790914, 'grad_clip_norm': 0.5, 'head_lr': 2.565773841975759e-05}.
[I 2026-03-15 17:07:55,084] Trial 14 finished with values: [0.8534798534798536, 0.7096774193543457, 0.4543162322403608] and parameters: {'lr': 5.953998939817118e-05, 'weight_decay': 0.00013314685368433056, 'label_smoothing': 0.05467354300782886, 'mixup_alpha': 0.0624154356805998, 'cutmix_alpha': 0.07092152536982073, 'loss': 'ce', 'focal_alpha': 0.3255538863943984, 'focal_gamma': 1.6349871897736725, 'optimizer': 'adam', 'scheduler': 'none', 'warmup_epochs': 0.3972472275176979, 'drop_path_rate': 0.18633654894059115, 'grad_clip_norm': 0.5, 'head_lr': 0.00027253458113737705}.
[I 2026-03-15 17:08:12,553] Trial 15 finished with values: [0.845467032967033, 0.6590909090904256, 0.47075973808486454] and parameters: {'lr': 8.929760802149442e-05, 'weight_decay': 6.219801441815397e-05, 'label_smoothing': 0.10972157340566355, 'mixup_alpha': 0.07512721400975991, 'cutmix_alpha': 0.05033661753094809, 'loss': 'focal', 'focal_alpha': 0.229331992372645, 'focal_gamma': 2.9330749539987124, 'optimizer': 'adam', 'scheduler': 'warmup_cosine', 'warmup_epochs': 1.4596228465823389, 'drop_path_rate': 0.08287020343790914, 'grad_clip_norm': 0.5, 'head_lr': 2.565773841975759e-05}.
[I 2026-03-15 17:08:28,946] Trial 16 finished with values: [0.8216575091575091, 0.5853658536580726, 0.5001722736981006] and parameters: {'lr': 3.0549770625486873e-05, 'weight_decay': 5.487002599870537e-05, 'label_smoothing': 0.07013985108289447, 'mixup_alpha': 0.13023387101575112, 'cutmix_alpha': 0.1758578423539238, 'loss': 'focal', 'focal_alpha': 0.353062113532131, 'focal_gamma': 2.118404208305278, 'optimizer': 'adamw', 'scheduler': 'plateau', 'warmup_epochs': 1.218987315987007, 'drop_path_rate': 0.19193220279936318, 'grad_clip_norm': 1.0, 'head_lr': 0.0006368008499365697}.
[I 2026-03-15 17:08:45,734] Trial 17 finished with values: [0.8946886446886447, 0.7878787878782891, 0.3967467337506348] and parameters: {'lr': 0.00039038155563885353, 'weight_decay': 0.00013314685368433056, 'label_smoothing': 0.07013985108289447, 'mixup_alpha': 0.13023387101575112, 'cutmix_alpha': 0.07092152536982073, 'loss': 'ce', 'focal_alpha': 0.3255538863943984, 'focal_gamma': 2.477056294619471, 'optimizer': 'adam', 'scheduler': 'plateau', 'warmup_epochs': 0.3972472275176979, 'drop_path_rate': 0.10525103346997158, 'grad_clip_norm': 1.0, 'head_lr': 0.00027253458113737705}.
[I 2026-03-15 17:09:03,420] Trial 18 finished with values: [0.8754578754578755, 0.7526881720425177, 0.4536166959182424] and parameters: {'lr': 0.00039038155563885353, 'weight_decay': 0.00013314685368433056, 'label_smoothing': 0.07013985108289447, 'mixup_alpha': 0.0624154356805998, 'cutmix_alpha': 0.1758578423539238, 'loss': 'focal', 'focal_alpha': 0.3255538863943984, 'focal_gamma': 1.6349871897736725, 'optimizer': 'adamw', 'scheduler': 'warmup_cosine', 'warmup_epochs': 0.3972472275176979, 'drop_path_rate': 0.18633654894059115, 'grad_clip_norm': 0.5, 'head_lr': 0.00027253458113737705}.
[I 2026-03-15 17:09:20,410] Trial 19 finished with values: [0.8392857142857143, 0.695652173912552, 0.4854003595659474] and parameters: {'lr': 3.0549770625486873e-05, 'weight_decay': 0.00013314685368433056, 'label_smoothing': 0.05467354300782886, 'mixup_alpha': 0.13023387101575112, 'cutmix_alpha': 0.1758578423539238, 'loss': 'ce', 'focal_alpha': 0.353062113532131, 'focal_gamma': 1.6349871897736725, 'optimizer': 'adam', 'scheduler': 'none', 'warmup_epochs': 0.3972472275176979, 'drop_path_rate': 0.18633654894059115, 'grad_clip_norm': 0.5, 'head_lr': 0.0006368008499365697}.
[I 2026-03-15 17:09:38,006] Trial 20 finished with values: [0.8326465201465202, 0.6741573033703007, 0.5661441196431222] and parameters: {'lr': 0.0010645160333653384, 'weight_decay': 1.250309443757088e-05, 'label_smoothing': 0.0852591229193136, 'mixup_alpha': 0.07512721400975991, 'cutmix_alpha': 0.05033661753094809, 'loss': 'ce', 'focal_alpha': 0.32206096955959296, 'focal_gamma': 2.9330749539987124, 'optimizer': 'adam', 'scheduler': 'warmup_cosine', 'warmup_epochs': 1.218987315987007, 'drop_path_rate': 0.03003669893377634, 'grad_clip_norm': 1.0, 'head_lr': 0.0018067510266103182}.
[I 2026-03-15 17:09:55,947] Trial 21 finished with values: [0.8189102564102564, 0.5569620253160057, 0.5103508168248521] and parameters: {'lr': 3.0549770625486873e-05, 'weight_decay': 3.819359486217119e-06, 'label_smoothing': 0.07013985108289447, 'mixup_alpha': 0.13023387101575112, 'cutmix_alpha': 0.1758578423539238, 'loss': 'focal', 'focal_alpha': 0.353062113532131, 'focal_gamma': 2.118404208305278, 'optimizer': 'adamw', 'scheduler': 'plateau', 'warmup_epochs': 0.9834946368917719, 'drop_path_rate': 0.19193220279936318, 'grad_clip_norm': 1.0, 'head_lr': 0.0006368008499365697}.
[I 2026-03-15 17:10:12,860] Trial 22 finished with values: [0.8814102564102564, 0.7499999999995035, 0.42666382764935734] and parameters: {'lr': 8.929760802149442e-05, 'weight_decay': 0.00013314685368433056, 'label_smoothing': 0.10582101578944057, 'mixup_alpha': 0.07512721400975991, 'cutmix_alpha': 0.05033661753094809, 'loss': 'focal', 'focal_alpha': 0.32206096955959296, 'focal_gamma': 2.9330749539987124, 'optimizer': 'adam', 'scheduler': 'none', 'warmup_epochs': 1.007858232895831, 'drop_path_rate': 0.04512752130412789, 'grad_clip_norm': 0.5, 'head_lr': 0.0018484086339045946}.
[I 2026-03-15 17:10:30,458] Trial 23 finished with values: [0.8653846153846153, 0.7755102040811344, 0.45304552081574195] and parameters: {'lr': 8.929760802149442e-05, 'weight_decay': 5.487002599870537e-05, 'label_smoothing': 0.0852591229193136, 'mixup_alpha': 0.07512721400975991, 'cutmix_alpha': 0.05033661753094809, 'loss': 'focal', 'focal_alpha': 0.32206096955959296, 'focal_gamma': 2.2737744505229474, 'optimizer': 'adam', 'scheduler': 'warmup_cosine', 'warmup_epochs': 1.007858232895831, 'drop_path_rate': 0.04512752130412789, 'grad_clip_norm': 0.5, 'head_lr': 0.0018067510266103182}.
100%|██████████████████████████████████████████████████████████████████████████████████████████████████████████████████████████████████████████████████████| 24/24 [07:33<00:00, 18.90s/it]
[MOO] Feasible Pareto trials meeting constraints: 1/3 (prec≥0.80, f1≥0.80, auc≥0.80)
    [MOO] Using selected Pareto config #0 for training: {'lr': 0.0010645160333653384, 'weight_decay': 5.487002599870537e-05, 'label_smoothing': 0.12152841132048821, 'mixup_alpha': 0.03838741029782664, 'cutmix_alpha': 0.08758001749283739, 'loss': 'focal', 'focal_alpha': 0.2878119607810443, 'focal_gamma': 2.2737744505229474, 'optimizer': 'adam', 'scheduler': 'warmup_cosine', 'warmup_epochs': 1.218987315987007, 'drop_path_rate': 0.03003669893377634, 'grad_clip_norm': 1.0, 'head_lr': 0.0018067510266103182}
    Ep 1: loss=0.0485/0.0810 acc=0.6985 prec=0.8235 rec=0.2692 f1=0.4058 auc=0.8052 thr=0.723(val_thr)
    Ep 2: loss=0.0378/0.4678 acc=0.7132 prec=0.8421 rec=0.3077 f1=0.4507 auc=0.7216 thr=0.570(val_thr)
    Ep 3: loss=0.0497/0.0832 acc=0.7353 prec=0.8636 rec=0.3654 f1=0.5135 auc=0.8397 thr=0.653(val_thr)
    Ep 4: loss=0.0384/0.0737 acc=0.8015 prec=0.8205 rec=0.6154 f1=0.7033 auc=0.8468 thr=0.527(val_thr)
    Ep 5: loss=0.0236/0.1026 acc=0.7794 prec=0.8235 rec=0.5385 f1=0.6512 auc=0.8562 thr=0.590(val_thr)
    Ep 6: loss=0.0236/0.0924 acc=0.7279 prec=0.8000 rec=0.3846 f1=0.5195 auc=0.8285 thr=0.619(val_thr)
    Ep 7: loss=0.0203/0.0777 acc=0.7721 prec=0.8000 rec=0.5385 f1=0.6437 auc=0.8313 thr=0.551(val_thr)
    Ep 8: loss=0.0216/0.0845 acc=0.7868 prec=0.8108 rec=0.5769 f1=0.6742 auc=0.8125 thr=0.463(val_thr)
    Early stopping at epoch 8.
    [FineTune] ORIGINAL-only for 5 epochs @ lr=1e-05
    [FineTune] Ep 1: loss=0.0240/0.0574
    [FineTune] Ep 2: loss=0.0247/0.0565
    [FineTune] Ep 3: loss=0.0212/0.0615
    [FineTune] Ep 4: loss=0.0252/0.0600
    [FineTune] Ep 5: loss=0.0226/0.0596
    Temperature scaling enabled: T=0.7987 (fit on validation)
    Using validation-tuned threshold 0.482 (val_prec=0.844, val_rec=0.731, val_f1=0.784) for test eval
    FINAL (efficientnet_b0, fold=0) [thr=0.482 (val_thr)] acc=0.7606 prec=0.7727 rec=0.6296 f1=0.6939 auc=0.8478

  Model: mobilenet_v3_large (224x224)
    [MOO] Optuna(NSGA-II) for mobilenet_v3_large -> outputs_mpox_balanced\fold_0\mobilenet_v3_large\moo
    [MOO] objectives=['auc', 'f1_at_precision', 'logloss'] directions=['maximize', 'maximize', 'minimize']
    [MOO] pop=8 gens=3 trials=24 eval_epochs=6
[I 2026-03-15 17:12:54,288] A new study created in memory with name: moo_mobilenet_v3_large_20260315_171254
[I 2026-03-15 17:13:46,987] Trial 0 finished with values: [0.8491300366300366, 0.695652173912552, 0.634666729137595] and parameters: {'lr': 0.002008037330173894, 'weight_decay': 1.2591462178530709e-05, 'label_smoothing': 0.027587821751564167, 'mixup_alpha': 0.08182411142121589, 'cutmix_alpha': 0.22709001163267467, 'loss': 'focal', 'focal_alpha': 0.3459531290614713, 'focal_gamma': 2.3722665938347793, 'optimizer': 'adam', 'scheduler': 'none', 'warmup_epochs': 0.5974074275387631, 'drop_path_rate': 0.131282236616454, 'grad_clip_norm': 1.0, 'head_lr': 0.0006203779517599349}.
[I 2026-03-15 17:13:59,647] Trial 1 finished with values: [0.9059065934065934, 0.8041237113397087, 0.38939853366416677] and parameters: {'lr': 0.00039038155563885353, 'weight_decay': 0.00031237281707197285, 'label_smoothing': 0.07013985108289447, 'mixup_alpha': 0.13023387101575112, 'cutmix_alpha': 0.1758578423539238, 'loss': 'focal', 'focal_alpha': 0.353062113532131, 'focal_gamma': 2.477056294619471, 'optimizer': 'adamw', 'scheduler': 'plateau', 'warmup_epochs': 0.9834946368917719, 'drop_path_rate': 0.10525103346997158, 'grad_clip_norm': 1.0, 'head_lr': 0.0006368008499365697}.
[I 2026-03-15 17:14:12,106] Trial 2 finished with values: [0.8871336996336997, 0.7272727272722438, 0.4954960597499775] and parameters: {'lr': 0.0010645160333653384, 'weight_decay': 5.487002599870537e-05, 'label_smoothing': 0.12152841132048821, 'mixup_alpha': 0.03838741029782664, 'cutmix_alpha': 0.08758001749283739, 'loss': 'focal', 'focal_alpha': 0.2878119607810443, 'focal_gamma': 2.2737744505229474, 'optimizer': 'adam', 'scheduler': 'warmup_cosine', 'warmup_epochs': 1.218987315987007, 'drop_path_rate': 0.03003669893377634, 'grad_clip_norm': 1.0, 'head_lr': 0.0018067510266103182}.
