[I 2026-03-15 16:39:28,389] Trial 18 finished with values: [0.8701923076923077, 0.7878787878782891, 0.4416871402649414] and parameters: {'lr': 5.953998939817118e-05, 'weight_decay': 5.487002599870537e-05, 'label_smoothing': 0.12152841132048821, 'mixup_alpha': 0.07512721400975991, 'cutmix_alpha': 0.08758001749283739, 'loss': 'focal', 'focal_alpha': 0.3255538863943984, 'focal_gamma': 2.9330749539987124, 'optimizer': 'adam', 'scheduler': 'warmup_cosine', 'warmup_epochs': 1.4596228465823389, 'drop_path_rate': 0.08287020343790914, 'grad_clip_norm': 0.5, 'head_lr': 2.565773841975759e-05}.
[I 2026-03-15 16:39:53,227] Trial 19 finished with values: [0.8853021978021978, 0.7843137254896961, 0.4472111124074791] and parameters: {'lr': 0.00039038155563885353, 'weight_decay': 0.00013314685368433056, 'label_smoothing': 0.05467354300782886, 'mixup_alpha': 0.13023387101575112, 'cutmix_alpha': 0.1758578423539238, 'loss': 'ce', 'focal_alpha': 0.32206096955959296, 'focal_gamma': 1.6349871897736725, 'optimizer': 'adam', 'scheduler': 'none', 'warmup_epochs': 0.3972472275176979, 'drop_path_rate': 0.18633654894059115, 'grad_clip_norm': 0.5, 'head_lr': 0.0006368008499365697}.
[I 2026-03-15 16:40:17,840] Trial 20 finished with values: [0.8660714285714286, 0.7191011235950198, 0.5333403656893002] and parameters: {'lr': 0.00039038155563885353, 'weight_decay': 5.487002599870537e-05, 'label_smoothing': 0.12152841132048821, 'mixup_alpha': 0.03838741029782664, 'cutmix_alpha': 0.08758001749283739, 'loss': 'ce', 'focal_alpha': 0.3255538863943984, 'focal_gamma': 2.2737744505229474, 'optimizer': 'adam', 'scheduler': 'plateau', 'warmup_epochs': 1.007858232895831, 'drop_path_rate': 0.10525103346997158, 'grad_clip_norm': 1.0, 'head_lr': 0.0006368008499365697}.
[I 2026-03-15 16:40:42,507] Trial 21 finished with values: [0.8516483516483516, 0.6511627906971962, 0.5311246935826954] and parameters: {'lr': 0.00039038155563885353, 'weight_decay': 3.819359486217119e-06, 'label_smoothing': 0.07013985108289447, 'mixup_alpha': 0.13023387101575112, 'cutmix_alpha': 0.1758578423539238, 'loss': 'focal', 'focal_alpha': 0.32206096955959296, 'focal_gamma': 2.477056294619471, 'optimizer': 'adamw', 'scheduler': 'plateau', 'warmup_epochs': 1.007858232895831, 'drop_path_rate': 0.10525103346997158, 'grad_clip_norm': 1.0, 'head_lr': 0.0006368008499365697}.
[I 2026-03-15 16:41:07,268] Trial 22 finished with values: [0.8816391941391941, 0.7659574468080164, 0.4207070504143995] and parameters: {'lr': 5.953998939817118e-05, 'weight_decay': 5.487002599870537e-05, 'label_smoothing': 0.10582101578944057, 'mixup_alpha': 0.0624154356805998, 'cutmix_alpha': 0.07092152536982073, 'loss': 'ce', 'focal_alpha': 0.3255538863943984, 'focal_gamma': 1.6349871897736725, 'optimizer': 'adam', 'scheduler': 'warmup_cosine', 'warmup_epochs': 0.3972472275176979, 'drop_path_rate': 0.18633654894059115, 'grad_clip_norm': 0.5, 'head_lr': 0.00027253458113737705}.
[I 2026-03-15 16:41:32,016] Trial 23 finished with values: [0.8482142857142856, 0.5999999999995449, 0.4887421410246477] and parameters: {'lr': 5.953998939817118e-05, 'weight_decay': 0.00013314685368433056, 'label_smoothing': 0.05467354300782886, 'mixup_alpha': 0.0624154356805998, 'cutmix_alpha': 0.07092152536982073, 'loss': 'ce', 'focal_alpha': 0.3255538863943984, 'focal_gamma': 1.6349871897736725, 'optimizer': 'adam', 'scheduler': 'none', 'warmup_epochs': 0.3972472275176979, 'drop_path_rate': 0.18633654894059115, 'grad_clip_norm': 0.5, 'head_lr': 0.00027253458113737705}.
100%|██████████████████████████████████████████████████████████████████████████████████████████████████████████████████████████████████████████████████████| 24/24 [10:43<00:00, 26.83s/it]
[MOO] Feasible Pareto trials meeting constraints: 1/5 (prec≥0.80, f1≥0.80, auc≥0.80)
    [MOO] Using selected Pareto config #0 for training: {'lr': 5.953998939817118e-05, 'weight_decay': 0.00013314685368433056, 'label_smoothing': 0.05467354300782886, 'mixup_alpha': 0.0624154356805998, 'cutmix_alpha': 0.07092152536982073, 'loss': 'ce', 'focal_alpha': 0.3255538863943984, 'focal_gamma': 1.6349871897736725, 'optimizer': 'adam', 'scheduler': 'none', 'warmup_epochs': 0.3972472275176979, 'drop_path_rate': 0.18633654894059115, 'grad_clip_norm': 0.5, 'head_lr': 0.00027253458113737705}
    Ep 1: loss=0.6483/0.6190 acc=0.6912 prec=0.8125 rec=0.2500 f1=0.3824 auc=0.7724 thr=0.597(val_thr)
    Ep 2: loss=0.5203/0.5212 acc=0.7500 prec=0.8462 rec=0.4231 f1=0.5641 auc=0.8434 thr=0.587(val_thr)
    Ep 3: loss=0.4128/0.4981 acc=0.8015 prec=0.8378 rec=0.5962 f1=0.6966 auc=0.8514 thr=0.550(val_thr)
    Ep 4: loss=0.3699/0.4842 acc=0.8088 prec=0.8421 rec=0.6154 f1=0.7111 auc=0.8567 thr=0.509(val_thr)
    Ep 5: loss=0.3365/0.4679 acc=0.8162 prec=0.8000 rec=0.6923 f1=0.7423 auc=0.8697 thr=0.445(val_thr)
    Ep 6: loss=0.3062/0.5104 acc=0.8235 prec=0.8333 rec=0.6731 f1=0.7447 auc=0.8617 thr=0.329(val_thr)
    Ep 7: loss=0.2733/0.4965 acc=0.8162 prec=0.8140 rec=0.6731 f1=0.7368 auc=0.8654 thr=0.344(val_thr)
    Ep 8: loss=0.3019/0.4525 acc=0.8235 prec=0.8043 rec=0.7115 f1=0.7551 auc=0.8860 thr=0.403(val_thr)
    Ep 9: loss=0.2854/0.5086 acc=0.8309 prec=0.8085 rec=0.7308 f1=0.7677 auc=0.8771 thr=0.265(val_thr)
    Ep 10: loss=0.2621/0.4219 acc=0.8824 prec=0.8103 rec=0.9038 f1=0.8545 auc=0.9116 thr=0.273(val_thr)
    Ep 11: loss=0.2271/0.5370 acc=0.8309 prec=0.8085 rec=0.7308 f1=0.7677 auc=0.8846 thr=0.179(val_thr)
    Ep 12: loss=0.2762/0.5035 acc=0.8456 prec=0.8039 rec=0.7885 f1=0.7961 auc=0.8844 thr=0.213(val_thr)
    Ep 13: loss=0.2641/0.4814 acc=0.8382 prec=0.8261 rec=0.7308 f1=0.7755 auc=0.8862 thr=0.302(val_thr)
    Ep 14: loss=0.2158/0.5634 acc=0.8309 prec=0.8537 rec=0.6731 f1=0.7527 auc=0.8745 thr=0.219(val_thr)
    Early stopping at epoch 14.
    [FineTune] ORIGINAL-only for 5 epochs @ lr=1e-05
    [FineTune] Ep 1: loss=0.1490/0.4511
    [FineTune] Ep 2: loss=0.1432/0.4574
    [FineTune] Ep 3: loss=0.1455/0.5627
    [FineTune] Ep 4: loss=0.1435/0.5014
    [FineTune] Ep 5: loss=0.1448/0.4986
    Temperature scaling enabled: T=1.0974 (fit on validation)
    Using validation-tuned threshold 0.323 (val_prec=0.808, val_rec=0.808, val_f1=0.808) for test eval
    FINAL (resnet50, fold=0) [thr=0.323 (val_thr)] acc=0.7979 prec=0.7529 rec=0.7901 f1=0.7711 auc=0.8990

  Model: densenet121 (224x224)
    [MOO] Optuna(NSGA-II) for densenet121 -> outputs_mpox_balanced\fold_0\densenet121\moo
    [MOO] objectives=['auc', 'f1_at_precision', 'logloss'] directions=['maximize', 'maximize', 'minimize']
    [MOO] pop=8 gens=3 trials=24 eval_epochs=6
[I 2026-03-15 16:44:55,689] A new study created in memory with name: moo_densenet121_20260315_164455
[I 2026-03-15 16:46:11,770] Trial 0 finished with values: [0.6584249084249084, 0.03773584905656675, 0.6501374358588705] and parameters: {'lr': 0.002008037330173894, 'weight_decay': 1.2591462178530709e-05, 'label_smoothing': 0.027587821751564167, 'mixup_alpha': 0.08182411142121589, 'cutmix_alpha': 0.22709001163267467, 'loss': 'focal', 'focal_alpha': 0.3459531290614713, 'focal_gamma': 2.3722665938347793, 'optimizer': 'adam', 'scheduler': 'none', 'warmup_epochs': 0.5974074275387631, 'drop_path_rate': 0.131282236616454, 'grad_clip_norm': 1.0, 'head_lr': 0.0006203779517599349}.
[I 2026-03-15 16:46:45,950] Trial 1 finished with values: [0.8033424908424909, 0.4657534246571244, 0.5907018974267901] and parameters: {'lr': 0.00039038155563885353, 'weight_decay': 0.00031237281707197285, 'label_smoothing': 0.07013985108289447, 'mixup_alpha': 0.13023387101575112, 'cutmix_alpha': 0.1758578423539238, 'loss': 'focal', 'focal_alpha': 0.353062113532131, 'focal_gamma': 2.477056294619471, 'optimizer': 'adamw', 'scheduler': 'plateau', 'warmup_epochs': 0.9834946368917719, 'drop_path_rate': 0.10525103346997158, 'grad_clip_norm': 1.0, 'head_lr': 0.0006368008499365697}.
[I 2026-03-15 16:47:18,201] Trial 2 finished with values: [0.842032967032967, 0.6590909090904256, 0.5416266640903106] and parameters: {'lr': 0.0010645160333653384, 'weight_decay': 5.487002599870537e-05, 'label_smoothing': 0.12152841132048821, 'mixup_alpha': 0.03838741029782664, 'cutmix_alpha': 0.08758001749283739, 'loss': 'focal', 'focal_alpha': 0.2878119607810443, 'focal_gamma': 2.2737744505229474, 'optimizer': 'adam', 'scheduler': 'warmup_cosine', 'warmup_epochs': 1.218987315987007, 'drop_path_rate': 0.03003669893377634, 'grad_clip_norm': 1.0, 'head_lr': 0.0018067510266103182}.
[I 2026-03-15 16:47:51,739] Trial 3 finished with values: [0.9212454212454212, 0.79166666666617, 0.3373289418829912] and parameters: {'lr': 8.929760802149442e-05, 'weight_decay': 1.250309443757088e-05, 'label_smoothing': 0.0852591229193136, 'mixup_alpha': 0.07512721400975991, 'cutmix_alpha': 0.05033661753094809, 'loss': 'focal', 'focal_alpha': 0.32206096955959296, 'focal_gamma': 2.9330749539987124, 'optimizer': 'adam', 'scheduler': 'warmup_cosine', 'warmup_epochs': 1.007858232895831, 'drop_path_rate': 0.04512752130412789, 'grad_clip_norm': 0.5, 'head_lr': 0.0018484086339045946}.
[I 2026-03-15 16:48:24,443] Trial 4 finished with values: [0.6316391941391941, 0.1428571428570102, 0.7759093969740514] and parameters: {'lr': 0.002196851309214333, 'weight_decay': 7.146824531193168e-05, 'label_smoothing': 0.037873889183614, 'mixup_alpha': 0.2883448232699392, 'cutmix_alpha': 0.14697550551783092, 'loss': 'ce', 'focal_alpha': 0.2560696940238141, 'focal_gamma': 2.127129466558014, 'optimizer': 'adam', 'scheduler': 'warmup_cosine', 'warmup_epochs': 0.21464582440208835, 'drop_path_rate': 0.18214507119308054, 'grad_clip_norm': 1.0, 'head_lr': 1.2758834036187525e-05}.
[I 2026-03-15 16:48:57,534] Trial 5 finished with values: [0.8843864468864469, 0.7356321839075651, 0.4085431838428906] and parameters: {'lr': 3.0549770625486873e-05, 'weight_decay': 1.0568584062233313e-05, 'label_smoothing': 0.09404998208578935, 'mixup_alpha': 0.034489242049100845, 'cutmix_alpha': 0.05717800792488386, 'loss': 'focal', 'focal_alpha': 0.4069877432369666, 'focal_gamma': 2.118404208305278, 'optimizer': 'adam', 'scheduler': 'plateau', 'warmup_epochs': 0.04104164931342402, 'drop_path_rate': 0.19193220279936318, 'grad_clip_norm': 1.0, 'head_lr': 0.00016317398002559875}.
[I 2026-03-15 16:49:29,895] Trial 6 finished with values: [0.6453754578754579, 0.4444444444440432, 0.6524076294912514] and parameters: {'lr': 0.001972552157600415, 'weight_decay': 6.219801441815397e-05, 'label_smoothing': 0.010823982260539683, 'mixup_alpha': 0.22700331927962544, 'cutmix_alpha': 0.24609727348949773, 'loss': 'ce', 'focal_alpha': 0.229331992372645, 'focal_gamma': 0.7434829134144465, 'optimizer': 'adamw', 'scheduler': 'warmup_cosine', 'warmup_epochs': 1.4596228465823389, 'drop_path_rate': 0.08287020343790914, 'grad_clip_norm': 0.5, 'head_lr': 2.565773841975759e-05}.
[I 2026-03-15 16:50:02,871] Trial 7 finished with values: [0.8981227106227107, 0.7799999999995008, 0.4186410091555238] and parameters: {'lr': 5.953998939817118e-05, 'weight_decay': 0.00013314685368433056, 'label_smoothing': 0.05467354300782886, 'mixup_alpha': 0.0624154356805998, 'cutmix_alpha': 0.07092152536982073, 'loss': 'ce', 'focal_alpha': 0.3255538863943984, 'focal_gamma': 1.6349871897736725, 'optimizer': 'adam', 'scheduler': 'none', 'warmup_epochs': 0.3972472275176979, 'drop_path_rate': 0.18633654894059115, 'grad_clip_norm': 0.5, 'head_lr': 0.00027253458113737705}.
[I 2026-03-15 16:50:35,677] Trial 8 finished with values: [0.6320970695970697, 0.358208955223533, 0.9675035028841175] and parameters: {'lr': 0.002008037330173894, 'weight_decay': 1.2591462178530709e-05, 'label_smoothing': 0.027587821751564167, 'mixup_alpha': 0.08182411142121589, 'cutmix_alpha': 0.22709001163267467, 'loss': 'focal', 'focal_alpha': 0.3459531290614713, 'focal_gamma': 2.3722665938347793, 'optimizer': 'adamw', 'scheduler': 'none', 'warmup_epochs': 0.5974074275387631, 'drop_path_rate': 0.074724092746879, 'grad_clip_norm': 1.0, 'head_lr': 0.0006203779517599349}.
[I 2026-03-15 16:51:08,988] Trial 9 finished with values: [0.8846153846153845, 0.7920792079202925, 0.40628881576934706] and parameters: {'lr': 3.0549770625486873e-05, 'weight_decay': 0.00031237281707197285, 'label_smoothing': 0.07013985108289447, 'mixup_alpha': 0.13023387101575112, 'cutmix_alpha': 0.1758578423539238, 'loss': 'focal', 'focal_alpha': 0.353062113532131, 'focal_gamma': 2.118404208305278, 'optimizer': 'adamw', 'scheduler': 'plateau', 'warmup_epochs': 0.9834946368917719, 'drop_path_rate': 0.19193220279936318, 'grad_clip_norm': 1.0, 'head_lr': 0.0006368008499365697}.
[I 2026-03-15 16:51:42,853] Trial 10 finished with values: [0.8482142857142857, 0.7843137254896961, 0.5686432079434444] and parameters: {'lr': 0.00039038155563885353, 'weight_decay': 1.250309443757088e-05, 'label_smoothing': 0.07013985108289447, 'mixup_alpha': 0.13023387101575112, 'cutmix_alpha': 0.1758578423539238, 'loss': 'focal', 'focal_alpha': 0.32206096955959296, 'focal_gamma': 2.477056294619471, 'optimizer': 'adamw', 'scheduler': 'plateau', 'warmup_epochs': 1.007858232895831, 'drop_path_rate': 0.10525103346997158, 'grad_clip_norm': 1.0, 'head_lr': 0.0006368008499365697}.
[I 2026-03-15 16:52:16,017] Trial 11 finished with values: [0.8889652014652015, 0.7551020408158282, 0.44051341436001273] and parameters: {'lr': 5.953998939817118e-05, 'weight_decay': 5.487002599870537e-05, 'label_smoothing': 0.12152841132048821, 'mixup_alpha': 0.03838741029782664, 'cutmix_alpha': 0.08758001749283739, 'loss': 'focal', 'focal_alpha': 0.3255538863943984, 'focal_gamma': 2.2737744505229474, 'optimizer': 'adam', 'scheduler': 'warmup_cosine', 'warmup_epochs': 0.8281836023531184, 'drop_path_rate': 0.03003669893377634, 'grad_clip_norm': 1.0, 'head_lr': 0.0018067510266103182}.
[I 2026-03-15 16:52:48,036] Trial 12 finished with values: [0.6126373626373627, 0.0, 0.7410454534256874] and parameters: {'lr': 0.002196851309214333, 'weight_decay': 1.0568584062233313e-05, 'label_smoothing': 0.09058608508710066, 'mixup_alpha': 0.2883448232699392, 'cutmix_alpha': 0.268699490942095, 'loss': 'focal', 'focal_alpha': 0.4069877432369666, 'focal_gamma': 2.127129466558014, 'optimizer': 'adam', 'scheduler': 'warmup_cosine', 'warmup_epochs': 0.21464582440208835, 'drop_path_rate': 0.18214507119308054, 'grad_clip_norm': 1.0, 'head_lr': 1.2758834036187525e-05}.
[I 2026-03-15 16:53:20,588] Trial 13 finished with values: [0.6618589743589745, 0.07407407407400274, 0.8171521367066428] and parameters: {'lr': 0.001972552157600415, 'weight_decay': 0.00031237281707197285, 'label_smoothing': 0.010823982260539683, 'mixup_alpha': 0.13023387101575112, 'cutmix_alpha': 0.24609727348949773, 'loss': 'focal', 'focal_alpha': 0.353062113532131, 'focal_gamma': 2.477056294619471, 'optimizer': 'adamw', 'scheduler': 'none', 'warmup_epochs': 0.9834946368917719, 'drop_path_rate': 0.08287020343790914, 'grad_clip_norm': 0.5, 'head_lr': 2.565773841975759e-05}.
[I 2026-03-15 16:53:54,328] Trial 14 finished with values: [0.9017857142857142, 0.7799999999995008, 0.4211638325779839] and parameters: {'lr': 5.953998939817118e-05, 'weight_decay': 0.00013314685368433056, 'label_smoothing': 0.05467354300782886, 'mixup_alpha': 0.0624154356805998, 'cutmix_alpha': 0.07092152536982073, 'loss': 'ce', 'focal_alpha': 0.3255538863943984, 'focal_gamma': 1.6349871897736725, 'optimizer': 'adam', 'scheduler': 'none', 'warmup_epochs': 0.3972472275176979, 'drop_path_rate': 0.18633654894059115, 'grad_clip_norm': 0.5, 'head_lr': 0.00027253458113737705}.
[I 2026-03-15 16:54:26,956] Trial 15 finished with values: [0.8937728937728938, 0.7499999999995035, 0.4087737856859711] and parameters: {'lr': 8.929760802149442e-05, 'weight_decay': 6.219801441815397e-05, 'label_smoothing': 0.10972157340566355, 'mixup_alpha': 0.07512721400975991, 'cutmix_alpha': 0.05033661753094809, 'loss': 'focal', 'focal_alpha': 0.229331992372645, 'focal_gamma': 2.9330749539987124, 'optimizer': 'adam', 'scheduler': 'warmup_cosine', 'warmup_epochs': 1.4596228465823389, 'drop_path_rate': 0.08287020343790914, 'grad_clip_norm': 0.5, 'head_lr': 2.565773841975759e-05}.
[I 2026-03-15 16:55:00,318] Trial 16 finished with values: [0.9100274725274725, 0.8190476190471191, 0.3977701281274751] and parameters: {'lr': 8.929760802149442e-05, 'weight_decay': 0.00031237281707197285, 'label_smoothing': 0.10972157340566355, 'mixup_alpha': 0.07512721400975991, 'cutmix_alpha': 0.05033661753094809, 'loss': 'focal', 'focal_alpha': 0.229331992372645, 'focal_gamma': 2.9330749539987124, 'optimizer': 'adam', 'scheduler': 'warmup_cosine', 'warmup_epochs': 0.9834946368917719, 'drop_path_rate': 0.08287020343790914, 'grad_clip_norm': 0.5, 'head_lr': 2.565773841975759e-05}.
[I 2026-03-15 16:55:33,068] Trial 17 finished with values: [0.903617216117216, 0.7961165048538689, 0.39612799880256244] and parameters: {'lr': 5.953998939817118e-05, 'weight_decay': 0.00031237281707197285, 'label_smoothing': 0.12152841132048821, 'mixup_alpha': 0.03838741029782664, 'cutmix_alpha': 0.1758578423539238, 'loss': 'focal', 'focal_alpha': 0.3255538863943984, 'focal_gamma': 2.2737744505229474, 'optimizer': 'adamw', 'scheduler': 'warmup_cosine', 'warmup_epochs': 0.8281836023531184, 'drop_path_rate': 0.03003669893377634, 'grad_clip_norm': 1.0, 'head_lr': 0.0006368008499365697}.
[I 2026-03-15 16:56:06,606] Trial 18 finished with values: [0.902014652014652, 0.7843137254896961, 0.399487064315474] and parameters: {'lr': 5.953998939817118e-05, 'weight_decay': 5.487002599870537e-05, 'label_smoothing': 0.12152841132048821, 'mixup_alpha': 0.07512721400975991, 'cutmix_alpha': 0.08758001749283739, 'loss': 'focal', 'focal_alpha': 0.3255538863943984, 'focal_gamma': 2.9330749539987124, 'optimizer': 'adam', 'scheduler': 'warmup_cosine', 'warmup_epochs': 1.4596228465823389, 'drop_path_rate': 0.08287020343790914, 'grad_clip_norm': 0.5, 'head_lr': 2.565773841975759e-05}.
[I 2026-03-15 16:56:39,915] Trial 19 finished with values: [0.8463827838827839, 0.6588235294112896, 0.5414640790616533] and parameters: {'lr': 0.00039038155563885353, 'weight_decay': 0.00031237281707197285, 'label_smoothing': 0.07013985108289447, 'mixup_alpha': 0.13023387101575112, 'cutmix_alpha': 0.1758578423539238, 'loss': 'focal', 'focal_alpha': 0.32206096955959296, 'focal_gamma': 2.118404208305278, 'optimizer': 'adamw', 'scheduler': 'plateau', 'warmup_epochs': 0.9834946368917719, 'drop_path_rate': 0.19193220279936318, 'grad_clip_norm': 1.0, 'head_lr': 0.0006368008499365697}.
[I 2026-03-15 16:57:12,553] Trial 20 finished with values: [0.8978937728937729, 0.7920792079202925, 0.42317346870331307] and parameters: {'lr': 3.0549770625486873e-05, 'weight_decay': 0.00013314685368433056, 'label_smoothing': 0.05467354300782886, 'mixup_alpha': 0.0624154356805998, 'cutmix_alpha': 0.07092152536982073, 'loss': 'ce', 'focal_alpha': 0.3255538863943984, 'focal_gamma': 1.6349871897736725, 'optimizer': 'adam', 'scheduler': 'plateau', 'warmup_epochs': 0.04104164931342402, 'drop_path_rate': 0.19193220279936318, 'grad_clip_norm': 1.0, 'head_lr': 0.00016317398002559875}.
[I 2026-03-15 16:57:45,881] Trial 21 finished with values: [0.8424908424908424, 0.6511627906971962, 0.507953023904934] and parameters: {'lr': 0.00039038155563885353, 'weight_decay': 3.819359486217119e-06, 'label_smoothing': 0.07013985108289447, 'mixup_alpha': 0.13023387101575112, 'cutmix_alpha': 0.1758578423539238, 'loss': 'focal', 'focal_alpha': 0.32206096955959296, 'focal_gamma': 2.477056294619471, 'optimizer': 'adamw', 'scheduler': 'plateau', 'warmup_epochs': 1.007858232895831, 'drop_path_rate': 0.10525103346997158, 'grad_clip_norm': 1.0, 'head_lr': 0.0006368008499365697}.
[I 2026-03-15 16:58:18,404] Trial 22 finished with values: [0.8786630036630035, 0.7252747252742353, 0.45186678411131137] and parameters: {'lr': 5.953998939817118e-05, 'weight_decay': 5.487002599870537e-05, 'label_smoothing': 0.10582101578944057, 'mixup_alpha': 0.0624154356805998, 'cutmix_alpha': 0.07092152536982073, 'loss': 'ce', 'focal_alpha': 0.3255538863943984, 'focal_gamma': 1.6349871897736725, 'optimizer': 'adam', 'scheduler': 'warmup_cosine', 'warmup_epochs': 0.3972472275176979, 'drop_path_rate': 0.18633654894059115, 'grad_clip_norm': 0.5, 'head_lr': 0.00027253458113737705}.
