[I 2026-03-15 17:18:42,979] Trial 23 finished with values: [0.8562271062271063, 0.574999999999545, 0.9768914696607768] and parameters: {'lr': 0.0010645160333653384, 'weight_decay': 0.00013314685368433056, 'label_smoothing': 0.12152841132048821, 'mixup_alpha': 0.03838741029782664, 'cutmix_alpha': 0.08758001749283739, 'loss': 'focal', 'focal_alpha': 0.2878119607810443, 'focal_gamma': 1.6349871897736725, 'optimizer': 'adam', 'scheduler': 'none', 'warmup_epochs': 1.218987315987007, 'drop_path_rate': 0.03003669893377634, 'grad_clip_norm': 1.0, 'head_lr': 0.00027253458113737705}.
100%|██████████████████████████████████████████████████████████████████████████████████████████████████████████████████████████████████████████████████████| 24/24 [05:48<00:00, 14.53s/it]
[MOO] Feasible Pareto trials meeting constraints: 1/1 (prec≥0.80, f1≥0.80, auc≥0.80)
    [MOO] Using selected Pareto config #0 for training: {'lr': 0.00039038155563885353, 'weight_decay': 0.00031237281707197285, 'label_smoothing': 0.07013985108289447, 'mixup_alpha': 0.13023387101575112, 'cutmix_alpha': 0.1758578423539238, 'loss': 'focal', 'focal_alpha': 0.353062113532131, 'focal_gamma': 2.477056294619471, 'optimizer': 'adamw', 'scheduler': 'plateau', 'warmup_epochs': 0.9834946368917719, 'drop_path_rate': 0.10525103346997158, 'grad_clip_norm': 1.0, 'head_lr': 0.0006368008499365697}
    Ep 1: loss=0.0358/0.0908 acc=0.7353 prec=0.8077 rec=0.4038 f1=0.5385 auc=0.7759 thr=0.453(val_thr)
    Ep 2: loss=0.0191/0.0803 acc=0.7647 prec=0.8125 rec=0.5000 f1=0.6190 auc=0.8336 thr=0.463(val_thr)
    Ep 3: loss=0.0146/0.1274 acc=0.8088 prec=0.8095 rec=0.6538 f1=0.7234 auc=0.8498 thr=0.391(val_thr)
    Ep 4: loss=0.0068/0.1623 acc=0.8309 prec=0.8085 rec=0.7308 f1=0.7677 auc=0.8672 thr=0.762(val_thr)
    Ep 5: loss=0.0050/0.1739 acc=0.8235 prec=0.8043 rec=0.7115 f1=0.7551 auc=0.8500 thr=0.399(val_thr)
    Ep 6: loss=0.0054/0.4438 acc=0.7206 prec=0.8182 rec=0.3462 f1=0.4865 auc=0.7445 thr=0.418(val_thr)
    Ep 7: loss=0.0108/0.1536 acc=0.7721 prec=0.8000 rec=0.5385 f1=0.6437 auc=0.8551 thr=0.898(val_thr)
    Ep 8: loss=0.0078/0.2051 acc=0.7794 prec=0.8235 rec=0.5385 f1=0.6512 auc=0.8434 thr=0.926(val_thr)
    Early stopping at epoch 8.
    [FineTune] ORIGINAL-only for 5 epochs @ lr=1e-05
    [FineTune] Ep 1: loss=0.0048/0.1211
    [FineTune] Ep 2: loss=0.0032/0.1044
    [FineTune] Ep 3: loss=0.0058/0.0950
    [FineTune] Ep 4: loss=0.0040/0.0925
    [FineTune] Ep 5: loss=0.0020/0.0901
    Temperature scaling enabled: T=1.2967 (fit on validation)
    Using validation-tuned threshold 0.376 (val_prec=0.833, val_rec=0.865, val_f1=0.849) for test eval
    FINAL (mobilenet_v3_large, fold=0) [thr=0.376 (val_thr)] acc=0.8404 prec=0.8696 rec=0.7407 f1=0.8000 auc=0.9117
[RAG] Backbone=efficientnetv2_s | ckpt=best_finetune.pt | img_size=224
[RAG] Extract embeddings: train_index_size=552 | bs=16 | workers=0 | tta=0
[RAG] Extract embeddings: val_size=136
[RAG] Extract embeddings: test_size=188
[RAG] Build kNN index + query: k=25 metric=cosine weighted=True chunk=512
  Ensemble(RAG): backbone=efficientnetv2_s k=25 alpha=0.250 src=train_orig_only metric=cosine weighted=True
  Ensemble: weighted_ensemble convnext_tiny=0.07 densenet121=0.03 efficientnet_b0=0.11 efficientnetv2_s=0.09 mobilenet_v3_large=0.62 resnet50=0.05 vit_b_16=0.03

============================================================
FOLD: 1 (rng_seed=12346)
============================================================
[LeakageCheck] ✅ No base-stem (leakage_id) appears in more than one split (filename heuristic).

  Model: efficientnetv2_s (224x224)
    [MOO] Using selected Pareto config #0 for training: {'lr': 0.00039038155563885353, 'weight_decay': 1.250309443757088e-05, 'label_smoothing': 0.07013985108289447, 'mixup_alpha': 0.13023387101575112, 'cutmix_alpha': 0.1758578423539238, 'loss': 'focal', 'focal_alpha': 0.32206096955959296, 'focal_gamma': 2.477056294619471, 'optimizer': 'adamw', 'scheduler': 'plateau', 'warmup_epochs': 1.007858232895831, 'drop_path_rate': 0.10525103346997158, 'grad_clip_norm': 1.0, 'head_lr': 0.0006368008499365697}
    Ep 1: loss=0.0404/54.0603 acc=0.7550 prec=0.8000 rec=0.6286 f1=0.7040 auc=0.8198 thr=0.441(val_thr)
    Ep 2: loss=0.0315/0.0393 acc=0.8212 prec=0.8116 rec=0.8000 f1=0.8058 auc=0.9014 thr=0.355(val_thr)
    Ep 3: loss=0.0136/3.1806 acc=0.8079 prec=0.8254 rec=0.7429 f1=0.7820 auc=0.8649 thr=0.338(val_thr)
    Ep 4: loss=0.0106/0.6972 acc=0.8013 prec=0.8125 rec=0.7429 f1=0.7761 auc=0.8388 thr=0.216(val_thr)
    Ep 5: loss=0.0218/0.0503 acc=0.8212 prec=0.8116 rec=0.8000 f1=0.8058 auc=0.8915 thr=0.468(val_thr)
    Ep 6: loss=0.0152/0.0759 acc=0.8146 prec=0.8281 rec=0.7571 f1=0.7910 auc=0.8764 thr=0.413(val_thr)
    Early stopping at epoch 6.
    [FineTune] ORIGINAL-only for 5 epochs @ lr=1e-05
    [FineTune] Ep 1: loss=0.0158/18.5295
    [FineTune] Ep 2: loss=0.0115/0.0420
    [FineTune] Ep 3: loss=0.0097/8.6323
    [FineTune] Ep 4: loss=0.0072/4.5345
    [FineTune] Ep 5: loss=0.0062/43.2140
    Temperature scaling enabled: T=7944.8198 (fit on validation)
    Using validation-tuned threshold 0.500 (val_prec=0.813, val_rec=0.871, val_f1=0.841) for test eval
    FINAL (efficientnetv2_s, fold=1) [thr=0.500 (val_thr)] acc=0.7688 prec=0.6250 rec=0.9375 f1=0.7500 auc=0.9400

  Model: convnext_tiny (224x224)
    [MOO] Using selected Pareto config #0 for training: {'lr': 3.0549770625486873e-05, 'weight_decay': 3.819359486217119e-06, 'label_smoothing': 0.07013985108289447, 'mixup_alpha': 0.13023387101575112, 'cutmix_alpha': 0.1758578423539238, 'loss': 'focal', 'focal_alpha': 0.353062113532131, 'focal_gamma': 2.118404208305278, 'optimizer': 'adamw', 'scheduler': 'plateau', 'warmup_epochs': 0.9834946368917719, 'drop_path_rate': 0.19193220279936318, 'grad_clip_norm': 1.0, 'head_lr': 0.0006368008499365697}
    Ep 1: loss=0.0543/0.0619 acc=0.7815 prec=0.8364 rec=0.6571 f1=0.7360 auc=0.8388 thr=0.441(val_thr)
    Ep 2: loss=0.0330/0.0520 acc=0.8079 prec=0.8060 rec=0.7714 f1=0.7883 auc=0.8875 thr=0.411(val_thr)
    Ep 3: loss=0.0190/0.0613 acc=0.8344 prec=0.8689 rec=0.7571 f1=0.8092 auc=0.8944 thr=0.366(val_thr)
    Ep 4: loss=0.0102/0.0696 acc=0.8212 prec=0.8308 rec=0.7714 f1=0.8000 auc=0.8898 thr=0.452(val_thr)
    Ep 5: loss=0.0067/0.0725 acc=0.8477 prec=0.8615 rec=0.8000 f1=0.8296 auc=0.9088 thr=0.319(val_thr)
    Ep 6: loss=0.0060/0.0724 acc=0.8344 prec=0.8082 rec=0.8429 f1=0.8252 auc=0.8970 thr=0.303(val_thr)
    Ep 7: loss=0.0028/0.0851 acc=0.8543 prec=0.9138 rec=0.7571 f1=0.8281 auc=0.8991 thr=0.456(val_thr)
    Ep 8: loss=0.0016/0.0862 acc=0.8543 prec=0.8750 rec=0.8000 f1=0.8358 auc=0.8998 thr=0.412(val_thr)
    Ep 9: loss=0.0019/0.0996 acc=0.8543 prec=0.8871 rec=0.7857 f1=0.8333 auc=0.9004 thr=0.364(val_thr)
    Ep 10: loss=0.0012/0.0817 acc=0.8675 prec=0.9032 rec=0.8000 f1=0.8485 auc=0.9093 thr=0.384(val_thr)
    Ep 11: loss=0.0010/0.1072 acc=0.8609 prec=0.9016 rec=0.7857 f1=0.8397 auc=0.9002 thr=0.335(val_thr)
    Ep 12: loss=0.0005/0.1096 acc=0.8609 prec=0.9016 rec=0.7857 f1=0.8397 auc=0.9007 thr=0.386(val_thr)
    Ep 13: loss=0.0007/0.1022 acc=0.8742 prec=0.9180 rec=0.8000 f1=0.8550 auc=0.9058 thr=0.474(val_thr)
    Ep 14: loss=0.0005/0.1093 acc=0.8675 prec=0.9167 rec=0.7857 f1=0.8462 auc=0.9072 thr=0.410(val_thr)
    Ep 15: loss=0.0003/0.1122 acc=0.8609 prec=0.8551 rec=0.8429 f1=0.8489 auc=0.9120 thr=0.155(val_thr)
    Ep 16: loss=0.0004/0.1083 acc=0.8675 prec=0.9167 rec=0.7857 f1=0.8462 auc=0.9079 thr=0.451(val_thr)
    Ep 17: loss=0.0003/0.1159 acc=0.8675 prec=0.9032 rec=0.8000 f1=0.8485 auc=0.9048 thr=0.359(val_thr)
    Early stopping at epoch 17.
    [FineTune] ORIGINAL-only for 5 epochs @ lr=1e-05
    [FineTune] Ep 1: loss=0.0007/0.1211
    [FineTune] Ep 2: loss=0.0007/0.1260
    [FineTune] Ep 3: loss=0.0014/0.1268
    [FineTune] Ep 4: loss=0.0005/0.1221
    [FineTune] Ep 5: loss=0.0002/0.1221
    Temperature scaling enabled: T=1.4602 (fit on validation)
    Using validation-tuned threshold 0.507 (val_prec=0.930, val_rec=0.757, val_f1=0.835) for test eval
    FINAL (convnext_tiny, fold=1) [thr=0.507 (val_thr)] acc=0.9306 prec=0.9194 rec=0.8906 f1=0.9048 auc=0.9725

  Model: vit_b_16 (224x224)
    [MOO] Using selected Pareto config #0 for training: {'lr': 3.0549770625486873e-05, 'weight_decay': 1.0568584062233313e-05, 'label_smoothing': 0.09404998208578935, 'mixup_alpha': 0.034489242049100845, 'cutmix_alpha': 0.05717800792488386, 'loss': 'focal', 'focal_alpha': 0.4069877432369666, 'focal_gamma': 2.118404208305278, 'optimizer': 'adam', 'scheduler': 'plateau', 'warmup_epochs': 0.04104164931342402, 'drop_path_rate': 0.19193220279936318, 'grad_clip_norm': 1.0, 'head_lr': 0.00016317398002559875}
    Ep 1: loss=0.0437/0.0526 acc=0.8212 prec=0.8413 rec=0.7571 f1=0.7970 auc=0.8880 thr=0.485(val_thr)
    Ep 2: loss=0.0214/0.0964 acc=0.8411 prec=0.8026 rec=0.8714 f1=0.8356 auc=0.9019 thr=0.211(val_thr)
    Ep 3: loss=0.0115/0.0686 acc=0.8543 prec=0.8333 rec=0.8571 f1=0.8451 auc=0.9178 thr=0.484(val_thr)
    Ep 4: loss=0.0069/0.0858 acc=0.8146 prec=0.8000 rec=0.8000 f1=0.8000 auc=0.9095 thr=0.311(val_thr)
    Ep 5: loss=0.0013/0.0899 acc=0.8146 prec=0.8387 rec=0.7429 f1=0.7879 auc=0.9026 thr=0.401(val_thr)
    Ep 6: loss=0.0003/0.1036 acc=0.8278 prec=0.8667 rec=0.7429 f1=0.8000 auc=0.9108 thr=0.292(val_thr)
    Ep 7: loss=0.0001/0.0966 acc=0.8079 prec=0.8154 rec=0.7571 f1=0.7852 auc=0.9115 thr=0.288(val_thr)
    Early stopping at epoch 7.
    [FineTune] ORIGINAL-only for 5 epochs @ lr=1e-05
    [FineTune] Ep 1: loss=0.0046/0.0704
    [FineTune] Ep 2: loss=0.0013/0.0952
    [FineTune] Ep 3: loss=0.0002/0.0907
    [FineTune] Ep 4: loss=0.0014/0.1316
    [FineTune] Ep 5: loss=0.0001/0.1059
    Temperature scaling enabled: T=0.9096 (fit on validation)
    Using validation-tuned threshold 0.350 (val_prec=0.813, val_rec=0.871, val_f1=0.841) for test eval
    FINAL (vit_b_16, fold=1) [thr=0.350 (val_thr)] acc=0.8439 prec=0.7342 rec=0.9062 f1=0.8112 auc=0.9517

  Model: resnet50 (224x224)
    [MOO] Using selected Pareto config #0 for training: {'lr': 5.953998939817118e-05, 'weight_decay': 0.00013314685368433056, 'label_smoothing': 0.05467354300782886, 'mixup_alpha': 0.0624154356805998, 'cutmix_alpha': 0.07092152536982073, 'loss': 'ce', 'focal_alpha': 0.3255538863943984, 'focal_gamma': 1.6349871897736725, 'optimizer': 'adam', 'scheduler': 'none', 'warmup_epochs': 0.3972472275176979, 'drop_path_rate': 0.18633654894059115, 'grad_clip_norm': 0.5, 'head_lr': 0.00027253458113737705}
    Ep 1: loss=0.6346/0.6163 acc=0.6954 prec=0.8000 rec=0.4571 f1=0.5818 auc=0.7783 thr=0.575(val_thr)
    Ep 2: loss=0.4888/0.5371 acc=0.7152 prec=0.8000 rec=0.5143 f1=0.6261 auc=0.8383 thr=0.594(val_thr)
    Ep 3: loss=0.4240/0.4995 acc=0.7682 prec=0.8182 rec=0.6429 f1=0.7200 auc=0.8628 thr=0.531(val_thr)
    Ep 4: loss=0.3404/0.4972 acc=0.8013 prec=0.8704 rec=0.6714 f1=0.7581 auc=0.8836 thr=0.440(val_thr)
    Ep 5: loss=0.3237/0.5011 acc=0.8079 prec=0.8060 rec=0.7714 f1=0.7883 auc=0.8915 thr=0.278(val_thr)
    Ep 6: loss=0.2947/0.4780 acc=0.8146 prec=0.8500 rec=0.7286 f1=0.7846 auc=0.8834 thr=0.382(val_thr)
    Ep 7: loss=0.3216/0.5306 acc=0.8079 prec=0.8361 rec=0.7286 f1=0.7786 auc=0.8658 thr=0.362(val_thr)
    Ep 8: loss=0.2899/0.4471 acc=0.8543 prec=0.8333 rec=0.8571 f1=0.8451 auc=0.9042 thr=0.329(val_thr)
    Ep 9: loss=0.3147/0.4800 acc=0.8477 prec=0.8133 rec=0.8714 f1=0.8414 auc=0.9053 thr=0.215(val_thr)
    Ep 10: loss=0.2325/0.4507 acc=0.8477 prec=0.8052 rec=0.8857 f1=0.8435 auc=0.9148 thr=0.203(val_thr)
    Ep 11: loss=0.2134/0.4905 acc=0.8278 prec=0.8143 rec=0.8143 f1=0.8143 auc=0.8979 thr=0.175(val_thr)
    Ep 12: loss=0.2338/0.5573 acc=0.8212 prec=0.8028 rec=0.8143 f1=0.8085 auc=0.8795 thr=0.149(val_thr)
    Early stopping at epoch 12.
    [FineTune] ORIGINAL-only for 5 epochs @ lr=1e-05
    [FineTune] Ep 1: loss=0.1736/0.4469
    [FineTune] Ep 2: loss=0.1583/0.4912
    [FineTune] Ep 3: loss=0.1439/0.4684
    [FineTune] Ep 4: loss=0.1431/0.5279
    [FineTune] Ep 5: loss=0.1455/0.5258
    Temperature scaling enabled: T=1.1275 (fit on validation)
    Using validation-tuned threshold 0.370 (val_prec=0.838, val_rec=0.814, val_f1=0.826) for test eval
    FINAL (resnet50, fold=1) [thr=0.370 (val_thr)] acc=0.8960 prec=0.8194 rec=0.9219 f1=0.8676 auc=0.9440

  Model: densenet121 (224x224)
    [MOO] Using selected Pareto config #0 for training: {'lr': 5.953998939817118e-05, 'weight_decay': 0.00013314685368433056, 'label_smoothing': 0.05467354300782886, 'mixup_alpha': 0.0624154356805998, 'cutmix_alpha': 0.07092152536982073, 'loss': 'ce', 'focal_alpha': 0.3255538863943984, 'focal_gamma': 1.6349871897736725, 'optimizer': 'adam', 'scheduler': 'none', 'warmup_epochs': 0.3972472275176979, 'drop_path_rate': 0.18633654894059115, 'grad_clip_norm': 0.5, 'head_lr': 0.00027253458113737705}
    Ep 1: loss=0.5569/0.5404 acc=0.6755 prec=0.8621 rec=0.3571 f1=0.5051 auc=0.8222 thr=0.686(val_thr)
    Ep 2: loss=0.3836/0.4851 acc=0.7682 prec=0.8182 rec=0.6429 f1=0.7200 auc=0.8735 thr=0.548(val_thr)
    Ep 3: loss=0.3429/0.5248 acc=0.7815 prec=0.8033 rec=0.7000 f1=0.7481 auc=0.8672 thr=0.405(val_thr)
    Ep 4: loss=0.3489/0.4790 acc=0.8079 prec=0.8727 rec=0.6857 f1=0.7680 auc=0.8774 thr=0.508(val_thr)
    Ep 5: loss=0.2836/0.5216 acc=0.8079 prec=0.8060 rec=0.7714 f1=0.7883 auc=0.8723 thr=0.319(val_thr)
    Ep 6: loss=0.3486/0.5288 acc=0.8146 prec=0.8182 rec=0.7714 f1=0.7941 auc=0.8857 thr=0.261(val_thr)
    Ep 7: loss=0.3013/0.4877 acc=0.8411 prec=0.8026 rec=0.8714 f1=0.8356 auc=0.8996 thr=0.214(val_thr)
    Ep 8: loss=0.2214/0.4876 acc=0.8278 prec=0.8056 rec=0.8286 f1=0.8169 auc=0.8942 thr=0.269(val_thr)
    Ep 9: loss=0.2286/0.5290 acc=0.8013 prec=0.8333 rec=0.7143 f1=0.7692 auc=0.8725 thr=0.388(val_thr)
    Ep 10: loss=0.2435/0.4807 acc=0.7815 prec=0.8246 rec=0.6714 f1=0.7402 auc=0.8928 thr=0.470(val_thr)
    Ep 11: loss=0.3224/0.4700 acc=0.8079 prec=0.8361 rec=0.7286 f1=0.7786 auc=0.8952 thr=0.469(val_thr)
    Early stopping at epoch 11.
    [FineTune] ORIGINAL-only for 5 epochs @ lr=1e-05
    [FineTune] Ep 1: loss=0.1565/0.5289
    [FineTune] Ep 2: loss=0.1565/0.4986
    [FineTune] Ep 3: loss=0.1475/0.4816
    [FineTune] Ep 4: loss=0.1504/0.4977
    [FineTune] Ep 5: loss=0.1508/0.4984
    Temperature scaling enabled: T=1.2147 (fit on validation)
    Using validation-tuned threshold 0.249 (val_prec=0.813, val_rec=0.871, val_f1=0.841) for test eval
    FINAL (densenet121, fold=1) [thr=0.249 (val_thr)] acc=0.8613 prec=0.7632 rec=0.9062 f1=0.8286 auc=0.9613

  Model: efficientnet_b0 (224x224)
    [MOO] Using selected Pareto config #0 for training: {'lr': 0.0010645160333653384, 'weight_decay': 5.487002599870537e-05, 'label_smoothing': 0.12152841132048821, 'mixup_alpha': 0.03838741029782664, 'cutmix_alpha': 0.08758001749283739, 'loss': 'focal', 'focal_alpha': 0.2878119607810443, 'focal_gamma': 2.2737744505229474, 'optimizer': 'adam', 'scheduler': 'warmup_cosine', 'warmup_epochs': 1.218987315987007, 'drop_path_rate': 0.03003669893377634, 'grad_clip_norm': 1.0, 'head_lr': 0.0018067510266103182}
    Ep 1: loss=0.0523/0.0610 acc=0.6490 prec=0.8400 rec=0.3000 f1=0.4421 auc=0.7772 thr=0.604(val_thr)
    Ep 2: loss=0.0432/0.3012 acc=0.7748 prec=0.8214 rec=0.6571 f1=0.7302 auc=0.7683 thr=0.755(val_thr)
    Ep 3: loss=0.0355/0.0987 acc=0.7815 prec=0.8033 rec=0.7000 f1=0.7481 auc=0.8446 thr=0.381(val_thr)
    Ep 4: loss=0.0349/0.0581 acc=0.7417 prec=0.8163 rec=0.5714 f1=0.6723 auc=0.8342 thr=0.497(val_thr)
    Ep 5: loss=0.0266/0.1213 acc=0.6358 prec=0.8000 rec=0.2857 f1=0.4211 auc=0.8004 thr=0.810(val_thr)
    Ep 6: loss=0.0219/0.0768 acc=0.7616 prec=0.8269 rec=0.6143 f1=0.7049 auc=0.8131 thr=0.420(val_thr)
    Ep 7: loss=0.0174/0.1107 acc=0.7748 prec=0.8000 rec=0.6857 f1=0.7385 auc=0.8476 thr=0.469(val_thr)
    Early stopping at epoch 7.
    [FineTune] ORIGINAL-only for 5 epochs @ lr=1e-05
    [FineTune] Ep 1: loss=0.0295/0.0764
    [FineTune] Ep 2: loss=0.0208/0.0830
    [FineTune] Ep 3: loss=0.0202/0.0798
    [FineTune] Ep 4: loss=0.0189/0.0829
    [FineTune] Ep 5: loss=0.0221/0.0866
    Temperature scaling enabled: T=1.5229 (fit on validation)
    Using validation-tuned threshold 0.437 (val_prec=0.804, val_rec=0.643, val_f1=0.714) for test eval
    FINAL (efficientnet_b0, fold=1) [thr=0.437 (val_thr)] acc=0.8555 prec=0.7671 rec=0.8750 f1=0.8175 auc=0.9197

  Model: mobilenet_v3_large (224x224)
    [MOO] Using selected Pareto config #0 for training: {'lr': 0.00039038155563885353, 'weight_decay': 0.00031237281707197285, 'label_smoothing': 0.07013985108289447, 'mixup_alpha': 0.13023387101575112, 'cutmix_alpha': 0.1758578423539238, 'loss': 'focal', 'focal_alpha': 0.353062113532131, 'focal_gamma': 2.477056294619471, 'optimizer': 'adamw', 'scheduler': 'plateau', 'warmup_epochs': 0.9834946368917719, 'drop_path_rate': 0.10525103346997158, 'grad_clip_norm': 1.0, 'head_lr': 0.0006368008499365697}
    Ep 1: loss=0.0418/0.1241 acc=0.6954 prec=0.8000 rec=0.4571 f1=0.5818 auc=0.7584 thr=0.313(val_thr)
    Ep 2: loss=0.0185/0.1312 acc=0.7815 prec=0.8033 rec=0.7000 f1=0.7481 auc=0.8277 thr=0.216(val_thr)
    Ep 3: loss=0.0121/0.1587 acc=0.7417 prec=0.8039 rec=0.5857 f1=0.6777 auc=0.8201 thr=0.371(val_thr)
    Ep 4: loss=0.0085/0.1289 acc=0.7947 prec=0.8545 rec=0.6714 f1=0.7520 auc=0.8430 thr=0.291(val_thr)
    Ep 5: loss=0.0088/0.1400 acc=0.8212 prec=0.8028 rec=0.8143 f1=0.8085 auc=0.8661 thr=0.178(val_thr)
    Ep 6: loss=0.0097/0.1016 acc=0.7616 prec=0.8864 rec=0.5571 f1=0.6842 auc=0.8568 thr=0.694(val_thr)
    Ep 7: loss=0.0087/0.1021 acc=0.7483 prec=0.8077 rec=0.6000 f1=0.6885 auc=0.8383 thr=0.578(val_thr)
    Ep 8: loss=0.0046/0.1685 acc=0.7947 prec=0.8095 rec=0.7286 f1=0.7669 auc=0.8638 thr=0.247(val_thr)
    Ep 9: loss=0.0037/0.1388 acc=0.8146 prec=0.8000 rec=0.8000 f1=0.8000 auc=0.8785 thr=0.165(val_thr)
    Early stopping at epoch 9.
    [FineTune] ORIGINAL-only for 5 epochs @ lr=1e-05
    [FineTune] Ep 1: loss=0.0088/0.1263
    [FineTune] Ep 2: loss=0.0090/0.1131
    [FineTune] Ep 3: loss=0.0036/0.1082
    [FineTune] Ep 4: loss=0.0044/0.1021
    [FineTune] Ep 5: loss=0.0047/0.1004
    Temperature scaling enabled: T=1.3847 (fit on validation)
    Using validation-tuned threshold 0.319 (val_prec=0.857, val_rec=0.857, val_f1=0.857) for test eval
    FINAL (mobilenet_v3_large, fold=1) [thr=0.319 (val_thr)] acc=0.8902 prec=0.7922 rec=0.9531 f1=0.8652 auc=0.9470
[RAG] Backbone=efficientnetv2_s | ckpt=best_finetune.pt | img_size=224
[RAG] Extract embeddings: train_index_size=552 | bs=16 | workers=0 | tta=0
[RAG] Extract embeddings: val_size=151
[RAG] Extract embeddings: test_size=173
WARNING: RAG ensemble blend failed: Input X contains NaN.
NearestNeighbors does not accept missing values encoded as NaN natively. For supervised learning, you might want to consider sklearn.ensemble.HistGradientBoostingClassifier and Regressor which accept missing values encoded as NaNs natively. Alternatively, it is possible to preprocess the data, for instance by using an imputer transformer in a pipeline or drop samples with missing values. See https://scikit-learn.org/stable/modules/impute.html You can find a list of all estimators that handle NaN values at the following page: https://scikit-learn.org/stable/modules/impute.html#estimators-that-handle-nan-values
  Ensemble: weighted_ensemble convnext_tiny=0.14 densenet121=0.03 efficientnet_b0=0.13 efficientnetv2_s=0.08 mobilenet_v3_large=0.09 resnet50=0.05 vit_b_16=0.48

============================================================
FOLD: 2 (rng_seed=12347)
============================================================
[LeakageCheck] ✅ No base-stem (leakage_id) appears in more than one split (filename heuristic).

  Model: efficientnetv2_s (224x224)
    [MOO] Using selected Pareto config #0 for training: {'lr': 0.00039038155563885353, 'weight_decay': 1.250309443757088e-05, 'label_smoothing': 0.07013985108289447, 'mixup_alpha': 0.13023387101575112, 'cutmix_alpha': 0.1758578423539238, 'loss': 'focal', 'focal_alpha': 0.32206096955959296, 'focal_gamma': 2.477056294619471, 'optimizer': 'adamw', 'scheduler': 'plateau', 'warmup_epochs': 1.007858232895831, 'drop_path_rate': 0.10525103346997158, 'grad_clip_norm': 1.0, 'head_lr': 0.0006368008499365697}
    Ep 1: loss=0.0404/0.1319 acc=0.7972 prec=0.8095 rec=0.6182 f1=0.7010 auc=0.8607 thr=0.712(val_thr)
    Ep 2: loss=0.0295/0.0355 acc=0.8531 prec=0.8148 rec=0.8000 f1=0.8073 auc=0.9192 thr=0.381(val_thr)
    Ep 3: loss=0.0236/0.0751 acc=0.8392 prec=0.8333 rec=0.7273 f1=0.7767 auc=0.9188 thr=0.224(val_thr)
    Ep 4: loss=0.0173/0.0517 acc=0.8112 prec=0.8043 rec=0.6727 f1=0.7327 auc=0.8897 thr=0.518(val_thr)
    Ep 5: loss=0.0138/0.0482 acc=0.8462 prec=0.9024 rec=0.6727 f1=0.7708 auc=0.9159 thr=0.614(val_thr)
    Ep 6: loss=0.0096/0.0407 acc=0.8811 prec=0.9130 rec=0.7636 f1=0.8317 auc=0.9322 thr=0.554(val_thr)
    Ep 7: loss=0.0078/0.0376 acc=0.8741 prec=0.8364 rec=0.8364 f1=0.8364 auc=0.9320 thr=0.449(val_thr)
    Ep 8: loss=0.0253/0.0281 acc=0.9091 prec=0.8889 rec=0.8727 f1=0.8807 auc=0.9620 thr=0.506(val_thr)
    Ep 9: loss=0.0090/0.0425 acc=0.8811 prec=0.8276 rec=0.8727 f1=0.8496 auc=0.9281 thr=0.293(val_thr)
    Ep 10: loss=0.0110/0.0360 acc=0.8881 prec=0.8197 rec=0.9091 f1=0.8621 auc=0.9481 thr=0.248(val_thr)
    Ep 11: loss=0.0084/0.0854 acc=0.8112 prec=0.8182 rec=0.6545 f1=0.7273 auc=0.8839 thr=0.370(val_thr)
    Ep 12: loss=0.0026/0.0746 acc=0.8392 prec=0.9444 rec=0.6182 f1=0.7473 auc=0.8973 thr=0.589(val_thr)
    Early stopping at epoch 12.
    [FineTune] ORIGINAL-only for 5 epochs @ lr=1e-05
    [FineTune] Ep 1: loss=0.0077/0.0269
    [FineTune] Ep 2: loss=0.0050/0.0230
    [FineTune] Ep 3: loss=0.0040/0.0266
    [FineTune] Ep 4: loss=0.0027/0.0232
    [FineTune] Ep 5: loss=0.0031/0.0231
    Temperature scaling enabled: T=0.5118 (fit on validation)
    Using validation-tuned threshold 0.213 (val_prec=0.825, val_rec=0.945, val_f1=0.881) for test eval
    FINAL (efficientnetv2_s, fold=2) [thr=0.213 (val_thr)] acc=0.8457 prec=0.7714 rec=0.8571 f1=0.8120 auc