[I 2026-03-15 16:09:24,379] Trial 9 finished with values: [0.8768315018315018, 0.7234042553186545, 0.6017081756261132] and parameters: {'lr': 3.0549770625486873e-05, 'weight_decay': 0.00031237281707197285, 'label_smoothing': 0.07013985108289447, 'mixup_alpha': 0.13023387101575112, 'cutmix_alpha': 0.1758578423539238, 'loss': 'focal', 'focal_alpha': 0.353062113532131, 'focal_gamma': 2.118404208305278, 'optimizer': 'adamw', 'scheduler': 'plateau', 'warmup_epochs': 0.9834946368917719, 'drop_path_rate': 0.19193220279936318, 'grad_clip_norm': 1.0, 'head_lr': 0.0006368008499365697}.
[I 2026-03-15 16:10:40,017] Trial 10 finished with values: [0.6602564102564102, 0.0, 0.652574545940057] and parameters: {'lr': 0.00039038155563885353, 'weight_decay': 1.250309443757088e-05, 'label_smoothing': 0.07013985108289447, 'mixup_alpha': 0.13023387101575112, 'cutmix_alpha': 0.1758578423539238, 'loss': 'focal', 'focal_alpha': 0.32206096955959296, 'focal_gamma': 2.477056294619471, 'optimizer': 'adamw', 'scheduler': 'plateau', 'warmup_epochs': 1.007858232895831, 'drop_path_rate': 0.10525103346997158, 'grad_clip_norm': 1.0, 'head_lr': 0.0006368008499365697}.
[I 2026-03-15 16:11:55,926] Trial 11 finished with values: [0.8779761904761905, 0.7551020408158282, 0.6004206252589057] and parameters: {'lr': 5.953998939817118e-05, 'weight_decay': 5.487002599870537e-05, 'label_smoothing': 0.12152841132048821, 'mixup_alpha': 0.03838741029782664, 'cutmix_alpha': 0.08758001749283739, 'loss': 'focal', 'focal_alpha': 0.3255538863943984, 'focal_gamma': 2.2737744505229474, 'optimizer': 'adam', 'scheduler': 'warmup_cosine', 'warmup_epochs': 0.8281836023531184, 'drop_path_rate': 0.03003669893377634, 'grad_clip_norm': 1.0, 'head_lr': 0.0018067510266103182}.
[I 2026-03-15 16:13:11,958] Trial 12 finished with values: [0.6007326007326007, 0.0, 0.6600569559485225] and parameters: {'lr': 0.002008037330173894, 'weight_decay': 1.0568584062233313e-05, 'label_smoothing': 0.09058608508710066, 'mixup_alpha': 0.08182411142121589, 'cutmix_alpha': 0.268699490942095, 'loss': 'focal', 'focal_alpha': 0.4069877432369666, 'focal_gamma': 2.3722665938347793, 'optimizer': 'adam', 'scheduler': 'none', 'warmup_epochs': 0.5974074275387631, 'drop_path_rate': 0.131282236616454, 'grad_clip_norm': 1.0, 'head_lr': 0.0006203779517599349}.
[I 2026-03-15 16:14:27,477] Trial 13 finished with values: [0.6199633699633699, 0.0, 0.6737059272408485] and parameters: {'lr': 0.001972552157600415, 'weight_decay': 7.146824531193168e-05, 'label_smoothing': 0.010823982260539683, 'mixup_alpha': 0.2883448232699392, 'cutmix_alpha': 0.24609727348949773, 'loss': 'ce', 'focal_alpha': 0.2560696940238141, 'focal_gamma': 2.127129466558014, 'optimizer': 'adamw', 'scheduler': 'none', 'warmup_epochs': 0.21464582440208835, 'drop_path_rate': 0.08287020343790914, 'grad_clip_norm': 0.5, 'head_lr': 2.565773841975759e-05}.
[I 2026-03-15 16:15:43,368] Trial 14 finished with values: [0.8695054945054945, 0.695652173912552, 0.694406515405783] and parameters: {'lr': 5.953998939817118e-05, 'weight_decay': 0.00013314685368433056, 'label_smoothing': 0.05467354300782886, 'mixup_alpha': 0.0624154356805998, 'cutmix_alpha': 0.07092152536982073, 'loss': 'ce', 'focal_alpha': 0.3255538863943984, 'focal_gamma': 1.6349871897736725, 'optimizer': 'adam', 'scheduler': 'none', 'warmup_epochs': 0.3972472275176979, 'drop_path_rate': 0.18633654894059115, 'grad_clip_norm': 0.5, 'head_lr': 0.00027253458113737705}.
[I 2026-03-15 16:16:58,947] Trial 15 finished with values: [0.5977564102564102, 0.2857142857139975, 0.7596807690380453] and parameters: {'lr': 8.929760802149442e-05, 'weight_decay': 7.146824531193168e-05, 'label_smoothing': 0.10972157340566355, 'mixup_alpha': 0.07512721400975991, 'cutmix_alpha': 0.05033661753094809, 'loss': 'focal', 'focal_alpha': 0.2560696940238141, 'focal_gamma': 2.9330749539987124, 'optimizer': 'adam', 'scheduler': 'warmup_cosine', 'warmup_epochs': 0.21464582440208835, 'drop_path_rate': 0.18214507119308054, 'grad_clip_norm': 1.0, 'head_lr': 1.2758834036187525e-05}.
[I 2026-03-15 16:18:14,917] Trial 16 finished with values: [0.8770604395604397, 0.7708333333328368, 0.6493149476994334] and parameters: {'lr': 3.0549770625486873e-05, 'weight_decay': 1.0568584062233313e-05, 'label_smoothing': 0.07013985108289447, 'mixup_alpha': 0.13023387101575112, 'cutmix_alpha': 0.1758578423539238, 'loss': 'focal', 'focal_alpha': 0.353062113532131, 'focal_gamma': 2.118404208305278, 'optimizer': 'adamw', 'scheduler': 'plateau', 'warmup_epochs': 0.04104164931342402, 'drop_path_rate': 0.19193220279936318, 'grad_clip_norm': 1.0, 'head_lr': 0.0006368008499365697}.
[I 2026-03-15 16:19:30,387] Trial 17 finished with values: [0.8830128205128206, 0.7234042553186545, 0.5667154531979576] and parameters: {'lr': 3.0549770625486873e-05, 'weight_decay': 0.00013314685368433056, 'label_smoothing': 0.07013985108289447, 'mixup_alpha': 0.13023387101575112, 'cutmix_alpha': 0.07092152536982073, 'loss': 'focal', 'focal_alpha': 0.353062113532131, 'focal_gamma': 2.118404208305278, 'optimizer': 'adam', 'scheduler': 'plateau', 'warmup_epochs': 0.9834946368917719, 'drop_path_rate': 0.19193220279936318, 'grad_clip_norm': 1.0, 'head_lr': 0.00027253458113737705}.
[I 2026-03-15 16:20:45,740] Trial 18 finished with values: [0.638507326007326, 0.03773584905656675, 0.6843114087640774] and parameters: {'lr': 8.929760802149442e-05, 'weight_decay': 1.250309443757088e-05, 'label_smoothing': 0.0852591229193136, 'mixup_alpha': 0.0624154356805998, 'cutmix_alpha': 0.05033661753094809, 'loss': 'focal', 'focal_alpha': 0.32206096955959296, 'focal_gamma': 1.6349871897736725, 'optimizer': 'adam', 'scheduler': 'warmup_cosine', 'warmup_epochs': 0.3972472275176979, 'drop_path_rate': 0.18633654894059115, 'grad_clip_norm': 0.5, 'head_lr': 0.00027253458113737705}.
[I 2026-03-15 16:22:01,105] Trial 19 finished with values: [0.8736263736263736, 0.6666666666661858, 0.749574528449986] and parameters: {'lr': 3.0549770625486873e-05, 'weight_decay': 0.00013314685368433056, 'label_smoothing': 0.05467354300782886, 'mixup_alpha': 0.13023387101575112, 'cutmix_alpha': 0.1758578423539238, 'loss': 'ce', 'focal_alpha': 0.353062113532131, 'focal_gamma': 1.6349871897736725, 'optimizer': 'adam', 'scheduler': 'none', 'warmup_epochs': 0.3972472275176979, 'drop_path_rate': 0.18633654894059115, 'grad_clip_norm': 0.5, 'head_lr': 0.0006368008499365697}.
[I 2026-03-15 16:23:16,420] Trial 20 finished with values: [0.8335622710622712, 0.697674418604173, 0.9478895768823948] and parameters: {'lr': 8.929760802149442e-05, 'weight_decay': 1.0568584062233313e-05, 'label_smoothing': 0.09404998208578935, 'mixup_alpha': 0.034489242049100845, 'cutmix_alpha': 0.05717800792488386, 'loss': 'ce', 'focal_alpha': 0.4069877432369666, 'focal_gamma': 2.118404208305278, 'optimizer': 'adam', 'scheduler': 'warmup_cosine', 'warmup_epochs': 1.007858232895831, 'drop_path_rate': 0.04512752130412789, 'grad_clip_norm': 0.5, 'head_lr': 0.0018484086339045946}.
[I 2026-03-15 16:24:32,818] Trial 21 finished with values: [0.8752289377289377, 0.6987951807224235, 0.5785001942429597] and parameters: {'lr': 3.0549770625486873e-05, 'weight_decay': 3.819359486217119e-06, 'label_smoothing': 0.07013985108289447, 'mixup_alpha': 0.13023387101575112, 'cutmix_alpha': 0.1758578423539238, 'loss': 'focal', 'focal_alpha': 0.353062113532131, 'focal_gamma': 2.118404208305278, 'optimizer': 'adamw', 'scheduler': 'plateau', 'warmup_epochs': 0.9834946368917719, 'drop_path_rate': 0.19193220279936318, 'grad_clip_norm': 1.0, 'head_lr': 0.0006368008499365697}.
[I 2026-03-15 16:25:48,645] Trial 22 finished with values: [0.8626373626373627, 0.7058823529407013, 0.9056458088396092] and parameters: {'lr': 3.0549770625486873e-05, 'weight_decay': 0.00013314685368433056, 'label_smoothing': 0.10582101578944057, 'mixup_alpha': 0.034489242049100845, 'cutmix_alpha': 0.05717800792488386, 'loss': 'focal', 'focal_alpha': 0.4069877432369666, 'focal_gamma': 2.118404208305278, 'optimizer': 'adam', 'scheduler': 'none', 'warmup_epochs': 0.04104164931342402, 'drop_path_rate': 0.19193220279936318, 'grad_clip_norm': 1.0, 'head_lr': 0.00016317398002559875}.
[I 2026-03-15 16:27:04,297] Trial 23 finished with values: [0.5920329670329669, 0.0, 0.7267463087254067] and parameters: {'lr': 3.0549770625486873e-05, 'weight_decay': 5.487002599870537e-05, 'label_smoothing': 0.09404998208578935, 'mixup_alpha': 0.034489242049100845, 'cutmix_alpha': 0.05717800792488386, 'loss': 'focal', 'focal_alpha': 0.4069877432369666, 'focal_gamma': 2.2737744505229474, 'optimizer': 'adam', 'scheduler': 'warmup_cosine', 'warmup_epochs': 0.04104164931342402, 'drop_path_rate': 0.19193220279936318, 'grad_clip_norm': 1.0, 'head_lr': 0.0018067510266103182}.
100%|██████████████████████████████████████████████████████████████████████████████████████████████████████████████████████████████████████████████████████| 24/24 [30:55<00:00, 77.33s/it]
[MOO] Feasible Pareto trials meeting constraints: 0/1 (prec≥0.80, f1≥0.80, auc≥0.80)
[MOO][WARN] No Pareto trials satisfied constraints; falling back to --moo_selection_strategy on the full Pareto front.
    [MOO] Using selected Pareto config #0 for training: {'lr': 3.0549770625486873e-05, 'weight_decay': 1.0568584062233313e-05, 'label_smoothing': 0.09404998208578935, 'mixup_alpha': 0.034489242049100845, 'cutmix_alpha': 0.05717800792488386, 'loss': 'focal', 'focal_alpha': 0.4069877432369666, 'focal_gamma': 2.118404208305278, 'optimizer': 'adam', 'scheduler': 'plateau', 'warmup_epochs': 0.04104164931342402, 'drop_path_rate': 0.19193220279936318, 'grad_clip_norm': 1.0, 'head_lr': 0.00016317398002559875}
    Ep 1: loss=0.0473/0.0635 acc=0.8162 prec=0.8140 rec=0.6731 f1=0.7368 auc=0.8629 thr=0.556(val_thr)
    Ep 2: loss=0.0157/0.1161 acc=0.7868 prec=0.8485 rec=0.5385 f1=0.6588 auc=0.8480 thr=0.356(val_thr)
    Ep 3: loss=0.0083/0.0991 acc=0.8088 prec=0.8250 rec=0.6346 f1=0.7174 auc=0.8523 thr=0.398(val_thr)
    Ep 4: loss=0.0054/0.1245 acc=0.7868 prec=0.8108 rec=0.5769 f1=0.6742 auc=0.8594 thr=0.399(val_thr)
    Ep 5: loss=0.0026/0.0943 acc=0.8456 prec=0.8298 rec=0.7500 f1=0.7879 auc=0.8826 thr=0.358(val_thr)
    Ep 6: loss=0.0011/0.1227 acc=0.8235 prec=0.8333 rec=0.6731 f1=0.7447 auc=0.8638 thr=0.453(val_thr)
    Ep 7: loss=0.0001/0.1267 acc=0.8162 prec=0.8140 rec=0.6731 f1=0.7368 auc=0.8633 thr=0.445(val_thr)
    Ep 8: loss=0.0001/0.1408 acc=0.8235 prec=0.8043 rec=0.7115 f1=0.7551 auc=0.8631 thr=0.303(val_thr)
    Ep 9: loss=0.0000/0.1387 acc=0.8235 prec=0.8182 rec=0.6923 f1=0.7500 auc=0.8633 thr=0.365(val_thr)
    Early stopping at epoch 9.
    [FineTune] ORIGINAL-only for 5 epochs @ lr=1e-05
    [FineTune] Ep 1: loss=0.0002/0.1166
    [FineTune] Ep 2: loss=0.0001/0.1372
    [FineTune] Ep 3: loss=0.0000/0.1349
    [FineTune] Ep 4: loss=0.0000/0.1478
    [FineTune] Ep 5: loss=0.0000/0.1544
    Temperature scaling enabled: T=1.2963 (fit on validation)
    Using validation-tuned threshold 0.567 (val_prec=0.809, val_rec=0.731, val_f1=0.768) for test eval
    FINAL (vit_b_16, fold=0) [thr=0.567 (val_thr)] acc=0.8564 prec=0.8750 rec=0.7778 f1=0.8235 auc=0.9123

  Model: resnet50 (224x224)
    [MOO] Optuna(NSGA-II) for resnet50 -> outputs_mpox_balanced\fold_0\resnet50\moo
    [MOO] objectives=['auc', 'f1_at_precision', 'logloss'] directions=['maximize', 'maximize', 'minimize']
    [MOO] pop=8 gens=3 trials=24 eval_epochs=6
[I 2026-03-15 16:30:48,201] A new study created in memory with name: moo_resnet50_20260315_163048
[I 2026-03-15 16:32:01,561] Trial 0 finished with values: [0.6266025641025641, 0.29032258064489075, 0.746096337518849] and parameters: {'lr': 0.002008037330173894, 'weight_decay': 1.2591462178530709e-05, 'label_smoothing': 0.027587821751564167, 'mixup_alpha': 0.08182411142121589, 'cutmix_alpha': 0.22709001163267467, 'loss': 'focal', 'focal_alpha': 0.3459531290614713, 'focal_gamma': 2.3722665938347793, 'optimizer': 'adam', 'scheduler': 'none', 'warmup_epochs': 0.5974074275387631, 'drop_path_rate': 0.131282236616454, 'grad_clip_norm': 1.0, 'head_lr': 0.0006203779517599349}.
[I 2026-03-15 16:32:26,432] Trial 1 finished with values: [0.8337912087912088, 0.7234042553186545, 0.47058103887118646] and parameters: {'lr': 0.00039038155563885353, 'weight_decay': 0.00031237281707197285, 'label_smoothing': 0.07013985108289447, 'mixup_alpha': 0.13023387101575112, 'cutmix_alpha': 0.1758578423539238, 'loss': 'focal', 'focal_alpha': 0.353062113532131, 'focal_gamma': 2.477056294619471, 'optimizer': 'adamw', 'scheduler': 'plateau', 'warmup_epochs': 0.9834946368917719, 'drop_path_rate': 0.10525103346997158, 'grad_clip_norm': 1.0, 'head_lr': 0.0006368008499365697}.
[I 2026-03-15 16:32:51,009] Trial 2 finished with values: [0.80242673992674, 0.5853658536580726, 0.5356657793557617] and parameters: {'lr': 0.0010645160333653384, 'weight_decay': 5.487002599870537e-05, 'label_smoothing': 0.12152841132048821, 'mixup_alpha': 0.03838741029782664, 'cutmix_alpha': 0.08758001749283739, 'loss': 'focal', 'focal_alpha': 0.2878119607810443, 'focal_gamma': 2.2737744505229474, 'optimizer': 'adam', 'scheduler': 'warmup_cosine', 'warmup_epochs': 1.218987315987007, 'drop_path_rate': 0.03003669893377634, 'grad_clip_norm': 1.0, 'head_lr': 0.0018067510266103182}.
[I 2026-03-15 16:33:16,207] Trial 3 finished with values: [0.8715659340659341, 0.6818181818176983, 0.4744976074473159] and parameters: {'lr': 8.929760802149442e-05, 'weight_decay': 1.250309443757088e-05, 'label_smoothing': 0.0852591229193136, 'mixup_alpha': 0.07512721400975991, 'cutmix_alpha': 0.05033661753094809, 'loss': 'focal', 'focal_alpha': 0.32206096955959296, 'focal_gamma': 2.9330749539987124, 'optimizer': 'adam', 'scheduler': 'warmup_cosine', 'warmup_epochs': 1.007858232895831, 'drop_path_rate': 0.04512752130412789, 'grad_clip_norm': 0.5, 'head_lr': 0.0018484086339045946}.
[I 2026-03-15 16:33:41,315] Trial 4 finished with values: [0.6540750915750916, 0.29032258064489075, 0.6562225233802434] and parameters: {'lr': 0.002196851309214333, 'weight_decay': 7.146824531193168e-05, 'label_smoothing': 0.037873889183614, 'mixup_alpha': 0.2883448232699392, 'cutmix_alpha': 0.14697550551783092, 'loss': 'ce', 'focal_alpha': 0.2560696940238141, 'focal_gamma': 2.127129466558014, 'optimizer': 'adam', 'scheduler': 'warmup_cosine', 'warmup_epochs': 0.21464582440208835, 'drop_path_rate': 0.18214507119308054, 'grad_clip_norm': 1.0, 'head_lr': 1.2758834036187525e-05}.
[I 2026-03-15 16:34:06,107] Trial 5 finished with values: [0.8509615384615384, 0.5853658536580726, 0.4837827197820765] and parameters: {'lr': 3.0549770625486873e-05, 'weight_decay': 1.0568584062233313e-05, 'label_smoothing': 0.09404998208578935, 'mixup_alpha': 0.034489242049100845, 'cutmix_alpha': 0.05717800792488386, 'loss': 'focal', 'focal_alpha': 0.4069877432369666, 'focal_gamma': 2.118404208305278, 'optimizer': 'adam', 'scheduler': 'plateau', 'warmup_epochs': 0.04104164931342402, 'drop_path_rate': 0.19193220279936318, 'grad_clip_norm': 1.0, 'head_lr': 0.00016317398002559875}.
[I 2026-03-15 16:34:30,826] Trial 6 finished with values: [0.7971611721611722, 0.4657534246571244, 0.5706642570641643] and parameters: {'lr': 0.001972552157600415, 'weight_decay': 6.219801441815397e-05, 'label_smoothing': 0.010823982260539683, 'mixup_alpha': 0.22700331927962544, 'cutmix_alpha': 0.24609727348949773, 'loss': 'ce', 'focal_alpha': 0.229331992372645, 'focal_gamma': 0.7434829134144465, 'optimizer': 'adamw', 'scheduler': 'warmup_cosine', 'warmup_epochs': 1.4596228465823389, 'drop_path_rate': 0.08287020343790914, 'grad_clip_norm': 0.5, 'head_lr': 2.565773841975759e-05}.
[I 2026-03-15 16:34:55,592] Trial 7 finished with values: [0.864010989010989, 0.8041237113397087, 0.48553704917636675] and parameters: {'lr': 5.953998939817118e-05, 'weight_decay': 0.00013314685368433056, 'label_smoothing': 0.05467354300782886, 'mixup_alpha': 0.0624154356805998, 'cutmix_alpha': 0.07092152536982073, 'loss': 'ce', 'focal_alpha': 0.3255538863943984, 'focal_gamma': 1.6349871897736725, 'optimizer': 'adam', 'scheduler': 'none', 'warmup_epochs': 0.3972472275176979, 'drop_path_rate': 0.18633654894059115, 'grad_clip_norm': 0.5, 'head_lr': 0.00027253458113737705}.
[I 2026-03-15 16:35:20,427] Trial 8 finished with values: [0.7095924908424909, 0.29032258064489075, 0.6564562675443805] and parameters: {'lr': 0.001972552157600415, 'weight_decay': 6.219801441815397e-05, 'label_smoothing': 0.010823982260539683, 'mixup_alpha': 0.22700331927962544, 'cutmix_alpha': 0.24609727348949773, 'loss': 'ce', 'focal_alpha': 0.229331992372645, 'focal_gamma': 0.7434829134144465, 'optimizer': 'adamw', 'scheduler': 'warmup_cosine', 'warmup_epochs': 1.4596228465823389, 'drop_path_rate': 0.074724092746879, 'grad_clip_norm': 0.5, 'head_lr': 2.565773841975759e-05}.
[I 2026-03-15 16:35:45,656] Trial 9 finished with values: [0.8454670329670328, 0.695652173912552, 0.4837579310156883] and parameters: {'lr': 3.0549770625486873e-05, 'weight_decay': 0.00031237281707197285, 'label_smoothing': 0.07013985108289447, 'mixup_alpha': 0.13023387101575112, 'cutmix_alpha': 0.1758578423539238, 'loss': 'focal', 'focal_alpha': 0.353062113532131, 'focal_gamma': 2.118404208305278, 'optimizer': 'adamw', 'scheduler': 'plateau', 'warmup_epochs': 0.9834946368917719, 'drop_path_rate': 0.19193220279936318, 'grad_clip_norm': 1.0, 'head_lr': 0.0006368008499365697}.
[I 2026-03-15 16:36:10,431] Trial 10 finished with values: [0.9148351648351648, 0.7799999999995008, 0.394424746434923] and parameters: {'lr': 0.00039038155563885353, 'weight_decay': 1.250309443757088e-05, 'label_smoothing': 0.07013985108289447, 'mixup_alpha': 0.13023387101575112, 'cutmix_alpha': 0.1758578423539238, 'loss': 'focal', 'focal_alpha': 0.32206096955959296, 'focal_gamma': 2.477056294619471, 'optimizer': 'adamw', 'scheduler': 'plateau', 'warmup_epochs': 1.007858232895831, 'drop_path_rate': 0.10525103346997158, 'grad_clip_norm': 1.0, 'head_lr': 0.0006368008499365697}.
[I 2026-03-15 16:36:35,188] Trial 11 finished with values: [0.8830128205128205, 0.7422680412366159, 0.4319188589958265] and parameters: {'lr': 5.953998939817118e-05, 'weight_decay': 5.487002599870537e-05, 'label_smoothing': 0.12152841132048821, 'mixup_alpha': 0.03838741029782664, 'cutmix_alpha': 0.08758001749283739, 'loss': 'focal', 'focal_alpha': 0.3255538863943984, 'focal_gamma': 2.2737744505229474, 'optimizer': 'adam', 'scheduler': 'warmup_cosine', 'warmup_epochs': 0.8281836023531184, 'drop_path_rate': 0.03003669893377634, 'grad_clip_norm': 1.0, 'head_lr': 0.0018067510266103182}.
[I 2026-03-15 16:36:59,602] Trial 12 finished with values: [0.5899725274725274, 0.29032258064489075, 0.6865013856440183] and parameters: {'lr': 0.002196851309214333, 'weight_decay': 1.0568584062233313e-05, 'label_smoothing': 0.09058608508710066, 'mixup_alpha': 0.2883448232699392, 'cutmix_alpha': 0.268699490942095, 'loss': 'focal', 'focal_alpha': 0.4069877432369666, 'focal_gamma': 2.127129466558014, 'optimizer': 'adam', 'scheduler': 'warmup_cosine', 'warmup_epochs': 0.21464582440208835, 'drop_path_rate': 0.18214507119308054, 'grad_clip_norm': 1.0, 'head_lr': 1.2758834036187525e-05}.
[I 2026-03-15 16:37:24,264] Trial 13 finished with values: [0.7154304029304029, 0.2580645161287617, 1.0019521193571108] and parameters: {'lr': 0.001972552157600415, 'weight_decay': 0.00031237281707197285, 'label_smoothing': 0.010823982260539683, 'mixup_alpha': 0.13023387101575112, 'cutmix_alpha': 0.24609727348949773, 'loss': 'focal', 'focal_alpha': 0.353062113532131, 'focal_gamma': 2.477056294619471, 'optimizer': 'adamw', 'scheduler': 'none', 'warmup_epochs': 0.9834946368917719, 'drop_path_rate': 0.08287020343790914, 'grad_clip_norm': 0.5, 'head_lr': 2.565773841975759e-05}.
[I 2026-03-15 16:37:48,932] Trial 14 finished with values: [0.8653846153846154, 0.7843137254896961, 0.45229979092574113] and parameters: {'lr': 5.953998939817118e-05, 'weight_decay': 0.00013314685368433056, 'label_smoothing': 0.05467354300782886, 'mixup_alpha': 0.0624154356805998, 'cutmix_alpha': 0.07092152536982073, 'loss': 'ce', 'focal_alpha': 0.3255538863943984, 'focal_gamma': 1.6349871897736725, 'optimizer': 'adam', 'scheduler': 'none', 'warmup_epochs': 0.3972472275176979, 'drop_path_rate': 0.18633654894059115, 'grad_clip_norm': 0.5, 'head_lr': 0.00027253458113737705}.
[I 2026-03-15 16:38:13,744] Trial 15 finished with values: [0.8777472527472527, 0.7835051546386778, 0.44017489599291104] and parameters: {'lr': 8.929760802149442e-05, 'weight_decay': 6.219801441815397e-05, 'label_smoothing': 0.10972157340566355, 'mixup_alpha': 0.07512721400975991, 'cutmix_alpha': 0.05033661753094809, 'loss': 'focal', 'focal_alpha': 0.229331992372645, 'focal_gamma': 2.9330749539987124, 'optimizer': 'adam', 'scheduler': 'warmup_cosine', 'warmup_epochs': 1.4596228465823389, 'drop_path_rate': 0.08287020343790914, 'grad_clip_norm': 0.5, 'head_lr': 2.565773841975759e-05}.
[I 2026-03-15 16:38:38,466] Trial 16 finished with values: [0.8598901098901099, 0.697674418604173, 0.4501020170380597] and parameters: {'lr': 5.953998939817118e-05, 'weight_decay': 1.250309443757088e-05, 'label_smoothing': 0.12152841132048821, 'mixup_alpha': 0.03838741029782664, 'cutmix_alpha': 0.08758001749283739, 'loss': 'focal', 'focal_alpha': 0.3255538863943984, 'focal_gamma': 2.2737744505229474, 'optimizer': 'adam', 'scheduler': 'warmup_cosine', 'warmup_epochs': 1.007858232895831, 'drop_path_rate': 0.03003669893377634, 'grad_clip_norm': 1.0, 'head_lr': 0.0018067510266103182}.
[I 2026-03-15 16:39:03,451] Trial 17 finished with values: [0.8972069597069595, 0.7333333333328453, 0.40384296043613926] and parameters: {'lr': 0.00039038155563885353, 'weight_decay': 5.487002599870537e-05, 'label_smoothing': 0.07013985108289447, 'mixup_alpha': 0.13023387101575112, 'cutmix_alpha': 0.08758001749283739, 'loss': 'focal', 'focal_alpha': 0.32206096955959296, 'focal_gamma': 2.477056294619471, 'optimizer': 'adam', 'scheduler': 'plateau', 'warmup_epochs': 1.007858232895831, 'drop_path_rate': 0.10525103346997158, 'grad_clip_norm': 1.0, 'head_lr': 0.0018067510266103182}.
