[I 2026-03-15 17:14:24,918] Trial 3 finished with values: [0.8390567765567766, 0.7234042553186545, 0.722318130197249] and parameters: {'lr': 8.929760802149442e-05, 'weight_decay': 1.250309443757088e-05, 'label_smoothing': 0.0852591229193136, 'mixup_alpha': 0.07512721400975991, 'cutmix_alpha': 0.05033661753094809, 'loss': 'focal', 'focal_alpha': 0.32206096955959296, 'focal_gamma': 2.9330749539987124, 'optimizer': 'adam', 'scheduler': 'warmup_cosine', 'warmup_epochs': 1.007858232895831, 'drop_path_rate': 0.04512752130412789, 'grad_clip_norm': 0.5, 'head_lr': 0.0018484086339045946}.
[I 2026-03-15 17:14:38,328] Trial 4 finished with values: [0.7248168498168498, 0.10909090909080595, 0.6004934855893763] and parameters: {'lr': 0.002196851309214333, 'weight_decay': 7.146824531193168e-05, 'label_smoothing': 0.037873889183614, 'mixup_alpha': 0.2883448232699392, 'cutmix_alpha': 0.14697550551783092, 'loss': 'ce', 'focal_alpha': 0.2560696940238141, 'focal_gamma': 2.127129466558014, 'optimizer': 'adam', 'scheduler': 'warmup_cosine', 'warmup_epochs': 0.21464582440208835, 'drop_path_rate': 0.18214507119308054, 'grad_clip_norm': 1.0, 'head_lr': 1.2758834036187525e-05}.
[I 2026-03-15 17:14:51,606] Trial 5 finished with values: [0.8195970695970697, 0.5066666666662414, 0.5397046724941135] and parameters: {'lr': 3.0549770625486873e-05, 'weight_decay': 1.0568584062233313e-05, 'label_smoothing': 0.09404998208578935, 'mixup_alpha': 0.034489242049100845, 'cutmix_alpha': 0.05717800792488386, 'loss': 'focal', 'focal_alpha': 0.4069877432369666, 'focal_gamma': 2.118404208305278, 'optimizer': 'adam', 'scheduler': 'plateau', 'warmup_epochs': 0.04104164931342402, 'drop_path_rate': 0.19193220279936318, 'grad_clip_norm': 1.0, 'head_lr': 0.00016317398002559875}.
[I 2026-03-15 17:15:04,609] Trial 6 finished with values: [0.8108974358974359, 0.533333333332908, 0.9051207103526979] and parameters: {'lr': 0.001972552157600415, 'weight_decay': 6.219801441815397e-05, 'label_smoothing': 0.010823982260539683, 'mixup_alpha': 0.22700331927962544, 'cutmix_alpha': 0.24609727348949773, 'loss': 'ce', 'focal_alpha': 0.229331992372645, 'focal_gamma': 0.7434829134144465, 'optimizer': 'adamw', 'scheduler': 'warmup_cosine', 'warmup_epochs': 1.4596228465823389, 'drop_path_rate': 0.08287020343790914, 'grad_clip_norm': 0.5, 'head_lr': 2.565773841975759e-05}.
[I 2026-03-15 17:15:17,234] Trial 7 finished with values: [0.8576007326007327, 0.7843137254896961, 0.5027832920106654] and parameters: {'lr': 5.953998939817118e-05, 'weight_decay': 0.00013314685368433056, 'label_smoothing': 0.05467354300782886, 'mixup_alpha': 0.0624154356805998, 'cutmix_alpha': 0.07092152536982073, 'loss': 'ce', 'focal_alpha': 0.3255538863943984, 'focal_gamma': 1.6349871897736725, 'optimizer': 'adam', 'scheduler': 'none', 'warmup_epochs': 0.3972472275176979, 'drop_path_rate': 0.18633654894059115, 'grad_clip_norm': 0.5, 'head_lr': 0.00027253458113737705}.
[I 2026-03-15 17:15:30,589] Trial 8 finished with values: [0.8312728937728936, 0.5066666666662414, 0.5123594959051002] and parameters: {'lr': 3.0549770625486873e-05, 'weight_decay': 1.0568584062233313e-05, 'label_smoothing': 0.09404998208578935, 'mixup_alpha': 0.034489242049100845, 'cutmix_alpha': 0.05717800792488386, 'loss': 'focal', 'focal_alpha': 0.4069877432369666, 'focal_gamma': 2.118404208305278, 'optimizer': 'adamw', 'scheduler': 'plateau', 'warmup_epochs': 0.04104164931342402, 'drop_path_rate': 0.074724092746879, 'grad_clip_norm': 1.0, 'head_lr': 0.00016317398002559875}.
[I 2026-03-15 17:15:43,199] Trial 9 finished with values: [0.7572115384615384, 0.0, 2.6710916865211063] and parameters: {'lr': 0.002008037330173894, 'weight_decay': 5.487002599870537e-05, 'label_smoothing': 0.12152841132048821, 'mixup_alpha': 0.03838741029782664, 'cutmix_alpha': 0.08758001749283739, 'loss': 'focal', 'focal_alpha': 0.2878119607810443, 'focal_gamma': 2.3722665938347793, 'optimizer': 'adam', 'scheduler': 'none', 'warmup_epochs': 1.218987315987007, 'drop_path_rate': 0.131282236616454, 'grad_clip_norm': 1.0, 'head_lr': 0.0018067510266103182}.
[I 2026-03-15 17:15:56,305] Trial 10 finished with values: [0.8704212454212454, 0.7234042553186545, 0.4887255273260692] and parameters: {'lr': 0.00039038155563885353, 'weight_decay': 0.00013314685368433056, 'label_smoothing': 0.07013985108289447, 'mixup_alpha': 0.13023387101575112, 'cutmix_alpha': 0.1758578423539238, 'loss': 'ce', 'focal_alpha': 0.3255538863943984, 'focal_gamma': 2.477056294619471, 'optimizer': 'adamw', 'scheduler': 'plateau', 'warmup_epochs': 0.3972472275176979, 'drop_path_rate': 0.10525103346997158, 'grad_clip_norm': 1.0, 'head_lr': 0.0006368008499365697}.
[I 2026-03-15 17:16:09,033] Trial 11 finished with values: [0.8450091575091575, 0.7368421052626624, 0.5469938347401179] and parameters: {'lr': 5.953998939817118e-05, 'weight_decay': 5.487002599870537e-05, 'label_smoothing': 0.12152841132048821, 'mixup_alpha': 0.03838741029782664, 'cutmix_alpha': 0.08758001749283739, 'loss': 'focal', 'focal_alpha': 0.3255538863943984, 'focal_gamma': 2.2737744505229474, 'optimizer': 'adam', 'scheduler': 'warmup_cosine', 'warmup_epochs': 0.8281836023531184, 'drop_path_rate': 0.03003669893377634, 'grad_clip_norm': 1.0, 'head_lr': 0.0018067510266103182}.
[I 2026-03-15 17:16:21,381] Trial 12 finished with values: [0.6144688644688645, 0.03773584905656675, 0.7916968779383173] and parameters: {'lr': 0.002196851309214333, 'weight_decay': 1.0568584062233313e-05, 'label_smoothing': 0.09058608508710066, 'mixup_alpha': 0.2883448232699392, 'cutmix_alpha': 0.268699490942095, 'loss': 'focal', 'focal_alpha': 0.4069877432369666, 'focal_gamma': 2.127129466558014, 'optimizer': 'adam', 'scheduler': 'warmup_cosine', 'warmup_epochs': 0.21464582440208835, 'drop_path_rate': 0.18214507119308054, 'grad_clip_norm': 1.0, 'head_lr': 1.2758834036187525e-05}.
[I 2026-03-15 17:16:34,635] Trial 13 finished with values: [0.815018315018315, 0.5853658536580726, 1.6448336014925913] and parameters: {'lr': 0.001972552157600415, 'weight_decay': 0.00031237281707197285, 'label_smoothing': 0.010823982260539683, 'mixup_alpha': 0.13023387101575112, 'cutmix_alpha': 0.24609727348949773, 'loss': 'focal', 'focal_alpha': 0.353062113532131, 'focal_gamma': 2.477056294619471, 'optimizer': 'adamw', 'scheduler': 'none', 'warmup_epochs': 0.9834946368917719, 'drop_path_rate': 0.08287020343790914, 'grad_clip_norm': 0.5, 'head_lr': 2.565773841975759e-05}.
[I 2026-03-15 17:16:47,729] Trial 14 finished with values: [0.8443223443223443, 0.7422680412366159, 0.5468994564927908] and parameters: {'lr': 5.953998939817118e-05, 'weight_decay': 0.00013314685368433056, 'label_smoothing': 0.05467354300782886, 'mixup_alpha': 0.0624154356805998, 'cutmix_alpha': 0.07092152536982073, 'loss': 'ce', 'focal_alpha': 0.3255538863943984, 'focal_gamma': 1.6349871897736725, 'optimizer': 'adam', 'scheduler': 'none', 'warmup_epochs': 0.3972472275176979, 'drop_path_rate': 0.18633654894059115, 'grad_clip_norm': 0.5, 'head_lr': 0.00027253458113737705}.
[I 2026-03-15 17:17:00,722] Trial 15 finished with values: [0.8621794871794872, 0.7835051546386778, 0.5012849337837069] and parameters: {'lr': 8.929760802149442e-05, 'weight_decay': 7.146824531193168e-05, 'label_smoothing': 0.10972157340566355, 'mixup_alpha': 0.07512721400975991, 'cutmix_alpha': 0.05033661753094809, 'loss': 'focal', 'focal_alpha': 0.2560696940238141, 'focal_gamma': 2.9330749539987124, 'optimizer': 'adam', 'scheduler': 'warmup_cosine', 'warmup_epochs': 0.21464582440208835, 'drop_path_rate': 0.18214507119308054, 'grad_clip_norm': 1.0, 'head_lr': 1.2758834036187525e-05}.
[I 2026-03-15 17:17:13,494] Trial 16 finished with values: [0.8347069597069597, 0.6741573033703007, 0.5636111702675795] and parameters: {'lr': 5.953998939817118e-05, 'weight_decay': 0.00031237281707197285, 'label_smoothing': 0.05467354300782886, 'mixup_alpha': 0.0624154356805998, 'cutmix_alpha': 0.07092152536982073, 'loss': 'ce', 'focal_alpha': 0.3255538863943984, 'focal_gamma': 1.6349871897736725, 'optimizer': 'adam', 'scheduler': 'none', 'warmup_epochs': 0.9834946368917719, 'drop_path_rate': 0.18633654894059115, 'grad_clip_norm': 0.5, 'head_lr': 0.00027253458113737705}.
[I 2026-03-15 17:17:26,233] Trial 17 finished with values: [0.8814102564102563, 0.7708333333328368, 0.4529793026766317] and parameters: {'lr': 0.00039038155563885353, 'weight_decay': 0.00013314685368433056, 'label_smoothing': 0.07013985108289447, 'mixup_alpha': 0.13023387101575112, 'cutmix_alpha': 0.07092152536982073, 'loss': 'ce', 'focal_alpha': 0.3255538863943984, 'focal_gamma': 2.477056294619471, 'optimizer': 'adam', 'scheduler': 'plateau', 'warmup_epochs': 0.3972472275176979, 'drop_path_rate': 0.10525103346997158, 'grad_clip_norm': 1.0, 'head_lr': 0.00027253458113737705}.
[I 2026-03-15 17:17:38,800] Trial 18 finished with values: [0.8543956043956045, 0.6585365853653896, 0.5136883864053777] and parameters: {'lr': 0.00039038155563885353, 'weight_decay': 0.00031237281707197285, 'label_smoothing': 0.07013985108289447, 'mixup_alpha': 0.07512721400975991, 'cutmix_alpha': 0.1758578423539238, 'loss': 'focal', 'focal_alpha': 0.353062113532131, 'focal_gamma': 2.9330749539987124, 'optimizer': 'adamw', 'scheduler': 'warmup_cosine', 'warmup_epochs': 0.21464582440208835, 'drop_path_rate': 0.18214507119308054, 'grad_clip_norm': 1.0, 'head_lr': 1.2758834036187525e-05}.
[I 2026-03-15 17:17:51,624] Trial 19 finished with values: [0.8440934065934067, 0.7368421052626624, 0.6330876190910392] and parameters: {'lr': 8.929760802149442e-05, 'weight_decay': 0.00013314685368433056, 'label_smoothing': 0.05467354300782886, 'mixup_alpha': 0.07512721400975991, 'cutmix_alpha': 0.05033661753094809, 'loss': 'ce', 'focal_alpha': 0.2560696940238141, 'focal_gamma': 1.6349871897736725, 'optimizer': 'adam', 'scheduler': 'none', 'warmup_epochs': 0.3972472275176979, 'drop_path_rate': 0.18633654894059115, 'grad_clip_norm': 0.5, 'head_lr': 1.2758834036187525e-05}.
[I 2026-03-15 17:18:04,757] Trial 20 finished with values: [0.8841575091575092, 0.6744186046506847, 0.5404903825486572] and parameters: {'lr': 0.00039038155563885353, 'weight_decay': 0.00013314685368433056, 'label_smoothing': 0.07013985108289447, 'mixup_alpha': 0.13023387101575112, 'cutmix_alpha': 0.1758578423539238, 'loss': 'ce', 'focal_alpha': 0.3255538863943984, 'focal_gamma': 2.477056294619471, 'optimizer': 'adamw', 'scheduler': 'plateau', 'warmup_epochs': 0.9834946368917719, 'drop_path_rate': 0.10525103346997158, 'grad_clip_norm': 1.0, 'head_lr': 0.0006368008499365697}.
[I 2026-03-15 17:18:17,152] Trial 21 finished with values: [0.8255494505494505, 0.5066666666662414, 0.5177886076282102] and parameters: {'lr': 3.0549770625486873e-05, 'weight_decay': 3.819359486217119e-06, 'label_smoothing': 0.09404998208578935, 'mixup_alpha': 0.034489242049100845, 'cutmix_alpha': 0.05717800792488386, 'loss': 'focal', 'focal_alpha': 0.4069877432369666, 'focal_gamma': 2.118404208305278, 'optimizer': 'adamw', 'scheduler': 'plateau', 'warmup_epochs': 0.04104164931342402, 'drop_path_rate': 0.074724092746879, 'grad_clip_norm': 1.0, 'head_lr': 0.00016317398002559875}.
[I 2026-03-15 17:18:30,275] Trial 22 finished with values: [0.8353937728937729, 0.6666666666661858, 0.5198526301633767] and parameters: {'lr': 5.953998939817118e-05, 'weight_decay': 0.00013314685368433056, 'label_smoothing': 0.10582101578944057, 'mixup_alpha': 0.0624154356805998, 'cutmix_alpha': 0.07092152536982073, 'loss': 'ce', 'focal_alpha': 0.3255538863943984, 'focal_gamma': 1.6349871897736725, 'optimizer': 'adam', 'scheduler': 'plateau', 'warmup_epochs': 0.3972472275176979, 'drop_path_rate': 0.18633654894059115, 'grad_clip_norm': 0.5, 'head_lr': 0.00027253458113737705}.
